Unnamed: 0,title,subreddit,created_utc
,"Fairly new bike but had a minor accident, should I trade in?",motorcycles,1625712204
,Highway loop (cruise mode),motorcycles,1625711796
,Aftermarket Digital Instrument Cluster,motorcycles,1625710759
,Thought I Wanted a Bike - Want To Return It,motorcycles,1625709528
,Advice for carrying heavier passenger,motorcycles,1625709448
,Opinions on Versys 650 vs V-Strom vs NC700/750,motorcycles,1625708466
,Oil smells like gas,motorcycles,1625708158
,"First time poster, haven’t seen too many groms on Reddit especially not done up ones. So here is my squid grom😄",motorcycles,1625707389
,Stopped to assist a rider hit at a round-about near my house.,motorcycles,1625706845
,Went down twice in 1 month.,motorcycles,1625706446
,Honda CRF230 Stripped Oil drain plug,motorcycles,1625706280
,Best motorcycle for me?,motorcycles,1625706096
,Illinois DMV Course,motorcycles,1625705688
,Motorcycle Loan recommendations?,motorcycles,1625705572
,How to obtain a motorcycle permit in CA when over 21?,motorcycles,1625704858
,CA Riders?,motorcycles,1625704750
,Need advice on my battery/stator.,motorcycles,1625704376
,Spark Plugs Diagnosis,motorcycles,1625704152
,There are so many KLR 650s out there it's always a good time to talk about doohickeys.,motorcycles,1625702000
,Kiden or SYM,motorcycles,1625701164
,Hey just want some recomendations for stuff,motorcycles,1625700710
,Thinking about riding a motorcycle for convenience,motorcycles,1625700461
,How to get insurance on a dual sport (beginner),motorcycles,1625700261
,2 questions,motorcycles,1625700235
,So mom backed into my bike...,motorcycles,1625699746
,Just rode a Harley for the first time. I think I get it now,motorcycles,1625698003
,How do you keep from sweating your ass off during commuting?,motorcycles,1625697556
,So Cal Riders? Curious if anyone here commutes up and down the 15 fwy everyday for work on a bike. What kind of bike do you have? How long have you been doing it? How is it?,motorcycles,1625697547
,To tall for bonneville t100,motorcycles,1625697034
,To tall for a bonneville,motorcycles,1625696844
,Questions to German riders with EC/TUV,motorcycles,1625696504
,Monster 1100 A2 rattling noise,motorcycles,1625695416
,2008 yamaha r6 with loose shuft lever?,motorcycles,1625695293
,Follow me for more content like that Dm me for exclusive presents ❤️❤️❤️🏍💦💦🦁🦁🦁,motorcycles,1625695019
,Access to dealer network,motorcycles,1625694428
,Car guy getting into Bikes. Need help,motorcycles,1625693472
,Starting to think about getting a bike,motorcycles,1625691679
,I found the perfect bike for the guy who puts lotion on his helmet. pic in text.,motorcycles,1625691609
,I want to listen to music while on the road. But..,motorcycles,1625691235
,Tire question?,motorcycles,1625690750
,Stolen motorbike register,motorcycles,1625690460
,New fork springs are longer than original.,motorcycles,1625688480
,Using your motorcycle as a rolling kitchen.,motorcycles,1625688446
,Steering Damper &amp; Phone Mounts,motorcycles,1625688217
,Is this counter steering?,motorcycles,1625688062
,N GA Forest Service roads GPX files,motorcycles,1625686165
,Clutch problem,motorcycles,1625686105
,Quick question for the more experienced,motorcycles,1625685933
,Lost front grip mid corner for a split second,motorcycles,1625685919
,It is truly amazing what some people can successfully carry on a small bike.,motorcycles,1625684969
,Chin mounts for cameras,motorcycles,1625684290
,Special thanks.,motorcycles,1625683789
,It might be time to invade Germany again...,motorcycles,1625683683
,DVLA added full motorcycle licence,motorcycles,1625683138
,As a newbie to big bikes I'm never getting rid of this. The sound ❤️,motorcycles,1625682999
,Help me choose,motorcycles,1625682920
,Anyone know the best way to clean the dirt out of my front sprocket?,motorcycles,1625682347
,Hey im a 17 year old looking into getting my moto license.,motorcycles,1625681291
,Anyone have any experience with custom vinyl wraps?,motorcycles,1625680417
,Shoei NXR helmet face wind,motorcycles,1625679798
,Mat for cleaning / work,motorcycles,1625678748
,Aprillia RS50 dies after idling,motorcycles,1625678228
,Looking for some insight in to my transmission,motorcycles,1625676755
,Enthusiast project,motorcycles,1625676725
,Motorcycle Mechanics,motorcycles,1625676461
,MA is just gorgeous,motorcycles,1625676115
,Beginner stunter,motorcycles,1625676101
,Shoei x spirit III sizing?,motorcycles,1625675525
,Purchase Advice on Riding Pants,motorcycles,1625674428
,2017 Indian Chief Darkhorse. No one at the Indian dealer can tell me what is making this insane chirping sound. It is most apparent at 60 km per hour in 4th gear. Disappears when you pull in the clutch. Please help me snark motorbike peeps.,motorcycles,1625674306
,Looking for my first bike. Is this too old/risky?,motorcycles,1625674243
,Do you have an idea for something you'd like to see?,motorcycles,1625674079
,Honda CBR 300 vs 500 on the highway &amp; feel,motorcycles,1625673779
,Removing fairings on beginner bike,motorcycles,1625672221
,50cc Conan Monkey,motorcycles,1625670648
,"New rider just bought my bike, concerned with a line on my rear tire?",motorcycles,1625669983
,Chain rings slowly dying,motorcycles,1625668835
,Want to ride a motorcycle but haven't ridden a bicycle in many years,motorcycles,1625668372
,Doberman sidecar on fatboy 21,motorcycles,1625667116
,Need help finding brake pads.,motorcycles,1625666759
,Could use some help diagnosing a failure that happened trailside the other day,motorcycles,1625666299
,"Can’t find any info, but swing arm stand VS spool stand?",motorcycles,1625665999
,Should i buy cheapest chain and sprockets i can find?,motorcycles,1625665889
,*For Canadians* do they supply you with a bike on the m1 test?,motorcycles,1625663968
,"Anyone recognize the make/model of this bike? They broke into my fleet vans, storage shed, etc. Will update with more pics as available. Cheers!",motorcycles,1625662191
,Michelin Anakee Wild Dual Sport/ Adventure Bike Tires First Impression,motorcycles,1625661831
,Best GPS,motorcycles,1625661589
,Gilera DNA 50 blockade?,motorcycles,1625659232
,Haggling @ a dealership,motorcycles,1625658498
,"Ducati monster 600 vs suzuki gs500, need help!",motorcycles,1625658168
,"food pegs, are they weldable",motorcycles,1625656805
,Are 600cc class motorcycles dying?,motorcycles,1625656156
,How crazy is this guy ? ....,motorcycles,1625655835
,Dose my scooter fit in this subreddit,motorcycles,1625655577
,Lower top speed in some gears.,motorcycles,1625655443
,Finally done with MSF course!,motorcycles,1625654789
,Problems with suzuki bandit 650 2008 fuel system,motorcycles,1625654554
,is there an inexpensive way to raise clip on's? ZX6R,motorcycles,1625654443
,Looking for reliable 125 cc,motorcycles,1625652944
,"I'm going to miss riding, only had a moped.",motorcycles,1625648743
,Honda cb125r 2021 exhaust,motorcycles,1625645939
,I need help describing something that might not exist,motorcycles,1625643502
,When did you start to feel confident while driving?,motorcycles,1625638684
,HELLS ANGELS TRY TO ELIMINATE 12919 LEADER IN TARGETTED AMBUSH... BUT SECRETLY CRAVE THE TASTE OF COCK? LET THIS BE A LISTEN TO ALL MOTORCYCLE DRIVERS... YOU HAVE GONE TO WAR WITH US...,motorcycles,1625637363
,"MSF in August, then it's ON!",motorcycles,1625635989
,I can sort of understand why some people ride with minimal gear now...,motorcycles,1625635344
,"2015 Vulcan 900. I have a Vance and Hines straight shot exhaust that fit a 2015 Kawasaki Vulcan 900. In good condition. Free to anyone that can use them. Just let me know. Salisbury, NC. Area",motorcycles,1625634125
,Okay hear me out...,motorcycles,1625633656
,Olay hear me out...,motorcycles,1625633589
,My 09 zx6r monster edition,motorcycles,1625633221
,any way to adjust ride height on first gen sv650s?,motorcycles,1625632999
,"bike totaled, is it ever worth it to buyback the salvage?",motorcycles,1625632987
,Dirt bike rear brake won't take fluid into master cylinder,motorcycles,1625632848
,What bike style is unappreciated because it's not cool or mainstream?,motorcycles,1625632244
,Do all USD forks need a spring compressor tool and why don't regular forks need them?,motorcycles,1625632165
,Just started riding.,motorcycles,1625631496
,Help: I'm trying to buy a motorcycle and it has a lien on it.,motorcycles,1625629051
,First bike + scrambler build,motorcycles,1625627758
,Rear brake just fade completely?,motorcycles,1625627342
,"Just signed up for my first track days, what should I expect?",motorcycles,1625625845
,What are these Pocket bike buttons?,motorcycles,1625624931
,Can someone please explain what these buttons are for? (Pocket bike),motorcycles,1625624488
,Luggage big enough to hold iPad Pro 12.9?,motorcycles,1625623136
,My R6 that was stolen last Friday just got recovered!,motorcycles,1625623088
,Hi-Vis Helmets,motorcycles,1625622936
,A few questions for the Niken riders,motorcycles,1625622509
,Can't find a visor for my EXO-400😭,motorcycles,1625622473
,Newbie motorcycle Question,motorcycles,1625621643
,Upgrade to a 600 or a litre class.,motorcycles,1625620091
,Honda cb125r 2021 exhaust,motorcycles,1625619976
,F700 GS Rekluse Clutch Question,motorcycles,1625617939
,ABS on the R3,motorcycles,1625616487
,ABS on the R3,motorcycles,1625616303
,NJ to FL trip run down,motorcycles,1625615918
,New Jersey -&gt; Florida Trip Run Down,motorcycles,1625615440
,what parts on motorbikes are aesthetically changeable?,motorcycles,1625613508
,Needs some road experience advices,motorcycles,1625612970
,08 CBR600RR Luggage Options,motorcycles,1625612935
,engine speed signal output,motorcycles,1625612456
,Hi guys any one know any good mopeds for under £1k?,motorcycles,1625612232
,I may be different...,motorcycles,1625612209
,Doing 6 days in/around Eastern KY / NE TN. Looking for reccos on places to hit,motorcycles,1625611708
,I hate AAA,motorcycles,1625611584
,"Moto Guzzi dies on idle when hot, unless I hold on the throttle for a few seconds",motorcycles,1625611114
,Riding Protection,motorcycles,1625610818
,Oil fluctuates so much? Question.,motorcycles,1625609596
,Looking for advice on a project bike. (Previous post removed),motorcycles,1625609394
,I want to take a trip from Dlorida to Oregon.,motorcycles,1625609313
,New rider and I had no idea one of my biggest obstacles was going to be remembering to turn off the damn blinker!!,motorcycles,1625609238
,Virago/ V Star 250,motorcycles,1625608689
,Cornering on an uneven road,motorcycles,1625608470
,Tachometer needle bouncing at steady freeway speeds?,motorcycles,1625608227
,Scraped a peg. What was I doing wrong?,motorcycles,1625607927
,Floorboards stuck after drop,motorcycles,1625607258
,Abs ligth turns off before driving,motorcycles,1625604375
,The things I’d forgotten,motorcycles,1625603537
,"Tall guy Sportbike 1,88cm(6'2)",motorcycles,1625603514
,Full titanium akrapovic exhaust on my S1K,motorcycles,1625603296
,18' Ninja 650 Slack and Alignment,motorcycles,1625603017
,Straps or Cargo Net?,motorcycles,1625602435
,FZ Canyon fun.,motorcycles,1625601220
,I forgot to take the disc lock off the front wheel of my bike while trying to move the bike onto the drive,motorcycles,1625600898
,Locking a jacket to your bike?,motorcycles,1625599936
,Spilled some brake fluid on my motorcycle screen!,motorcycles,1625599597
,"Which phrase is more common in your opinion? ""Alcohol Free Gas"" or ""Ethanol Free Gas""?",motorcycles,1625599080
,2003 CBR600RR Rebuild w/Album Link,motorcycles,1625598646
,Beginner bike (A2),motorcycles,1625598108
,Possible noise coming from my bike?,motorcycles,1625597554
,Apprehensive about faster bikes,motorcycles,1625597450
,"I’m as safe as I can be, but sometimes you gotta have a little bit of controlled fun",motorcycles,1625597344
,Hey! It's not a 4 cylinder super sport bike but It sure is special for me. Gotta love the simplicity and reliability of this bike. 1983 Honda CG 125. Hope you guys like it,motorcycles,1625596602
,Honda Rebel 500 vs. Truimph T100 - for Beginner Motorcyclist,motorcycles,1625596020
,What engines fit in a sinnis Apache?,motorcycles,1625595872
,What are good alternatives for comfort seats?,motorcycles,1625594916
,When you are doing 100+ and bus overtakes you *someone please insert Inital D music*,motorcycles,1625593965
,"Turns out, my 70's Honda is not reliable",motorcycles,1625593151
,Yamaha yzf r125 speedometer problem.,motorcycles,1625592744
,What DMV’s near Chicago offer motorcycle road tests.,motorcycles,1625592731
,Dumb question regarding wheel size. I have a GSXS1000F ABS. The back tire currently is a 190/55/17. Can I place a 190/50/17 on the back without any issues as well?,motorcycles,1625590887
,Good idea to buy a motorcycle while in college/grad school?,motorcycles,1625589113
,Titling a 79 Yamaha DT100 for off-road use in North Dakota,motorcycles,1625588722
,Titling a 79 yamaha dt100 enduro for off-road use,motorcycles,1625588673
,Something went flying of my bike,motorcycles,1625588464
,"I Know These Questions are Everywhere and Often Removed, but Clutch Advice",motorcycles,1625587655
,My 89 Kawasaki,motorcycles,1625587004
,My Buell XT12 and I at Deals Gap in October of 2014,motorcycles,1625586228
,"My Buell XT12 and I in Deals Gap, October 2014",motorcycles,1625585921
,Any recommendations for a safe and still fun beginner bike?,motorcycles,1625585433
,Degreaser/de rust before or after? Or both?,motorcycles,1625584672
,How to get vanity plates for new bike,motorcycles,1625584641
,Rapidly Deflating Rear Tyre and Continual Instability,motorcycles,1625584630
,8 year old gloves on the track?,motorcycles,1625582942
,Leaving for 2 weeks on the PCH in a few days - any other suggestions for the emergency kit?,motorcycles,1625582691
,July 4th Lincoln Tunnel into NYC,motorcycles,1625582325
,"Can’t get this clip off my grom, someone help please😂",motorcycles,1625581801
,Ride into NYC through Lincoln Tunnel Jul 4 2021,motorcycles,1625581766
,Any suggestions for a phone mount when most handlebar mounts don't work?,motorcycles,1625580868
,"Sweet spot for someone who likes classic stripped down looks, but is looking to start touring?",motorcycles,1625579950
,2013 Ninja 400R SE parts search,motorcycles,1625579172
,Clutch overheating?,motorcycles,1625579081
,CT110 (Postie) as a first bike?,motorcycles,1625578714
,"Since getting my license on the fourth, riding my motorcycle is what I look forward to most each day now.",motorcycles,1625577455
,Motorcycle beginner in need of some advice,motorcycles,1625576558
,I can't find cheap headset with a headphone jack,motorcycles,1625573661
,High speed ride!,motorcycles,1625573101
,dynamo problem motorcycle,motorcycles,1625566213
,Keanu Reeves ARCH MOTORCYCLES,motorcycles,1625565280
,My little mishap a few years back. Braking (to late) on a tar line in the road.,motorcycles,1625560991
,"Could motorcycle forks technically be not circular, but more oval shaped? Or is there a reason why they must be circular?",motorcycles,1625560071
,Any German members?,motorcycles,1625559586
,"Hard time finding jacket, pants, or one piece suits that fit (5'6 - 137lbs) Male",motorcycles,1625559178
,Off to do my CBT tomorrow and I can't be more exited,motorcycles,1625556258
,Vulcan S Wobble in Corners,motorcycles,1625555077
,Motorcycle content,motorcycles,1625555050
,I went on the Highway for the first time tonight,motorcycles,1625555001
,Is it okay to learn to drive a motorcycle before driving?,motorcycles,1625554860
,Ready for track day now. Dumper looks a little weird when not bent over in riding position,motorcycles,1625551089
,"The Tenere 700 is way more capable than you might think - LONG, steep hill climb",motorcycles,1625549058
,Anybody ever use Battery Tender batteries? Are they any good?,motorcycles,1625548142
,Definitely one of the scariest moments I have caught on video!,motorcycles,1625547125
,Shifting into neutral,motorcycles,1625545619
,My front sprocket nut keeps spinning and won't tighten at all. Tried another nut; same thing. Could it be an issue with the threads?,motorcycles,1625545355
,I know some people adapt motorcycle engines to small race cars like Sprint cars. Is there a subreddit or forum for That ? What are they called? Is there a special circuit or class for That ? any Companies that sell conversion kits ? What engines are they using ?,motorcycles,1625543944
,First cruiser bike,motorcycles,1625543266
,How do I start to trust my new bike (complete noob here),motorcycles,1625543116
,😀,motorcycles,1625543086
,I bought stock pipes for my vstar 650 and it's friggen awesome!,motorcycles,1625540480
,Help Please?,motorcycles,1625538768
,Noise when shifting down to first from neutral,motorcycles,1625538297
,Green grass blue skies and empty roads. Riding bliss,motorcycles,1625537676
,Flip-up helmet with ECE + MIPS,motorcycles,1625537661
,I think i hit a bug,motorcycles,1625537170
,Big brain needed,motorcycles,1625536535
,"I'm a new rider and after riding (and damaging) my GM's 2007 Harley Dyna Low-rider, I realized I need better skills to ride. Any tips? More details below.",motorcycles,1625535245
,Camera interference,motorcycles,1625533815
,Putting Keeway Superlight 125 parts on a Keeway K-Light,motorcycles,1625532237
,"Need a reliable, powerful, lightweight bike engine for my airplane. Also, whats a good source for small turbos ?",motorcycles,1625531522
,Do Frame Sliders prevent any damage to your bike? Or only damage to your fairings?,motorcycles,1625531039
,How has your CSC San Gabriel 250 held up over time?,motorcycles,1625530838
,Anyone got any tips for leading a group on a ride??,motorcycles,1625528969
,What does it mean when a license plate number is not found?,motorcycles,1625527760
,Rant about city road management,motorcycles,1625526918
,Removing a stuck pilot screw with Nitric Acid,motorcycles,1625525526
,Custom Build vs Original Refurbish $$$?,motorcycles,1625524944
,Getting a motorcycle license,motorcycles,1625524666
,Beginner looking for some help on equipment,motorcycles,1625524385
,Major downshifting problem and a constant beeping sound,motorcycles,1625523180
,Columbus Ohio seems they want to shake down motorcyclists. The way I read it they want to coherse law enforcement to violate the rights of riders.,motorcycles,1625522743
,Can anyone explain the differences in the S1000rr models?,motorcycles,1625522092
,Is your bike supposed to be making this sound when it’s turned off? It’s only a 650 but I never even went above 50mph in 5th gear.,motorcycles,1625522015
,Aprilia To Recall Hundreds Of RS 660 and Tuono 660 Worldwide,motorcycles,1625521686
,Advice on repairs or totalled bike please!,motorcycles,1625520676
,Motorcycle thieves and Force,motorcycles,1625519902
,Bought a Victory...,motorcycles,1625519829
,Brought home a Victory Judge....,motorcycles,1625519589
,Your opinion for total new guy that wants something fast,motorcycles,1625519554
,Is this going to break the bank?,motorcycles,1625519425
,Brought home a Victory....,motorcycles,1625519291
,"Safest Helmet and Why: Shoei RF-1400, Shoe X-14, or Something Else? (Budget: $1000)",motorcycles,1625519230
,Are bike clones bad to get,motorcycles,1625519200
,Brought home a Victory....,motorcycles,1625518950
,Brought home a Victory...,motorcycles,1625518869
,These Charming Necklaces are FREE for a Limited Time! Check them out,motorcycles,1625518306
,Should these tires be replaced?,motorcycles,1625517541
,03-09 SV 650 grab bar wanted,motorcycles,1625517478
,I put about 200 kms on while the front tire had no pressure. It felt like is was 'a little low' but when I got home the tire gauge didn't even register. I'm still shaking my head.,motorcycles,1625517407
,Wind Noise with ear plugs,motorcycles,1625516864
,Annoying man blocks view.,motorcycles,1625516328
,Motorcycle helmet for women,motorcycles,1625515904
,What am I allowed to do with motorcycle permit? (18 years old),motorcycles,1625515285
,Where to find info on motorcycle emissions,motorcycles,1625514553
,Should I wait for the break-in period to be done before I add a slip-on exhaust to my bike?,motorcycles,1625514458
,Battlax S22 lifespan question. Were my pressures too high?,motorcycles,1625513602
,Is a more powerful Honda Africa Twin ‘Turbo’ on the...,motorcycles,1625512930
,Sylvain Guintoli tests Michelin PowerGP on track,motorcycles,1625510805
,Cyclist killed after pulling gun in road rage incident,motorcycles,1625510565
,Good roads in Petaluma (CA) area for beginner rider,motorcycles,1625508970
,The Perfect Helmet (For Me),motorcycles,1625508813
,"Had a stowaway, guess I need to take her out more often!",motorcycles,1625508803
,Any experience with VIN plate replacements on a Suzuki?,motorcycles,1625508676
,"Guys, I need your advice BADLY",motorcycles,1625508614
,"Indentations on Michelin Road5 2CT, anyone notice these and maybe know what they are for?",motorcycles,1625508471
,Outdoor Storage Advice (Ducati SupersportS),motorcycles,1625507964
,If countersteering works at any speed then how do you countersteer to turn right if you're turning left at full lock?,motorcycles,1625507676
,Renting a motorcycle in Italy?,motorcycles,1625507638
,Buying bike from a relative (owner deceased),motorcycles,1625507404
,SV650 Track bike opinions,motorcycles,1625507119
,Im thinking of starting to ride and I need your advice,motorcycles,1625506549
,gone with the wind 😂,motorcycles,1625505666
,"Please someone with mechanical experience ANY IDEA?? I admit I've toppled the bike once, but it was semi-graceful as I tried to keep it upright best I could but it fell anyway. Brand new bike as you can see, 220mi on it. Sorry for the compression/loss of quality.",motorcycles,1625504904
,Riding Pikes Peak today,motorcycles,1625504224
,Right turn from stop. Dropped bike. No more virgin.,motorcycles,1625503620
,2002 suzuki vl800 intruder speedometer issues,motorcycles,1625503278
,Yo those of you who thought my CBR400RR is my first bike,motorcycles,1625502339
,Well I finally did it.,motorcycles,1625500372
,"My tank smells of petrol, any ideas what it could be?",motorcycles,1625499897
,"My tank smells of petrol, any ideas what it could be?",motorcycles,1625499800
,Was he lame splitting too fast?,motorcycles,1625499671
,Accessories for 2004 Kawasaki Vulcan 500,motorcycles,1625498947
,Registration,motorcycles,1625498911
,Thought about buying a motorcycle for 20+ years but still super concerned about safety,motorcycles,1625498501
,My 2018 Yamaha R3 fuel gage,motorcycles,1625498015
,A nice day for a ride,motorcycles,1625497005
,Yamaha MT-125,motorcycles,1625496520
,2000 YZFR6 5EB LINERS,motorcycles,1625496008
,Hello all good 2 wheels people. Help a guy out and check out this 2 wheels film channel. Click subscribe and like. Motorcycle community is known for helping so im counting on you. Thanks for your time. Safe ride...,motorcycles,1625494761
,Helmet Shopping,motorcycles,1625494346
,"Will it be feasible to own a bike, if im rarely at home?",motorcycles,1625492813
,Have yall ever driven over a pothole so fast this happened?,motorcycles,1625491931
,Need help,motorcycles,1625491511
,Foreigner looking for advice for a solo riding trip from LA to Chicago with a stop at Sturgis,motorcycles,1625490907
,Looking for project bike ideas/advice.,motorcycles,1625490625
,Will my insurance cover me,motorcycles,1625490253
,A smashed wrist and a lesson learnt,motorcycles,1625490085
,Post MSF Training Resources,motorcycles,1625489745
,Cbr600rr rpms,motorcycles,1625489353
,Is my rim bent or am i seeing things? I was out riding doing 100kmh thru a corner and suddenly a big bump in the road just comes out of nowhere.,motorcycles,1625488761
,Is it a good idea to start renting out your motorbike in Sweeden,motorcycles,1625487521
,Looking for a riding buddy west orange NJ. Just got back on 2 wheels and I need some company. Anyone up for a ride or 2 ?,motorcycles,1625487221
,"First bike, first month of riding, first drop",motorcycles,1625486430
,hole in break caliper piston,motorcycles,1625486073
,How to fix throttle lag on a 1989 MZ 125?,motorcycles,1625485333
,Purchase Advice Superthread,motorcycles,1625482811
,tail tidy for 15-19 yamaha R1,motorcycles,1625482791
,restoring faded old plastic case,motorcycles,1625480841
,Need advice on how to get my bike home for repairs after an accident.,motorcycles,1625474624
,Wheelies &amp; 2stroke oil in France!,motorcycles,1625473951
,Honda Grom clutch issues,motorcycles,1625472405
,Bent front rim (motorcycle crash),motorcycles,1625471744
,Bent from rim.,motorcycles,1625471119
,New bike battery short? Almost caught on fire.,motorcycles,1625469078
,Drag bike options.,motorcycles,1625465458
,"Discussing tires, 2002 Buell M2",motorcycles,1625463703
,Why do people sink money in to bikes they don't ride?,motorcycles,1625461909
,Aftermarket Fairings,motorcycles,1625460132
,Best boots for crashing,motorcycles,1625458717
,Random Flat Tire - Help Needed,motorcycles,1625458220
,new rider looking at a 1985 suzuki gs450l,motorcycles,1625458012
,Infamous Hells Angels bunker in Sherbrooke torn down Five members of the Laval chapter of the Hells Angels were gunned down at the site in 1985,motorcycles,1625456892
,Two wheeled physics still not known,motorcycles,1625456445
,Have an extra space in your group for sturgis?,motorcycles,1625453232
,Has anyone rented or ridden Switzerland during the summer?,motorcycles,1625451623
,4th of July Ranch Special!,motorcycles,1625451221
,"I really slipped quickly into the zone today. Thought about all of the ways motorcycling is like life. Avoiding obstacles, picking lines, target fixation, enduring and overcoming pain and inclement weather. Then the pinical of euphoria of great views, surreal riding conditions like riding in clouds",motorcycles,1625451137
,Another endorsement?,motorcycles,1625449091
