Unnamed: 0,title,subreddit,created_utc
0.0,Recently got my dream bike and made a video about it!,motorcycles,1626811776
1.0,Cruiser Wrist Discomfort,motorcycles,1626808971
2.0,I hear a squealing sound when Giving my bike throttle.,motorcycles,1626807505
3.0,Are bootleg or flare leg jeans safe on a motorcycle?,motorcycles,1626807009
4.0,Ruroc Atlas 3.0 Review - The good and the bad,motorcycles,1626806529
5.0,Honda Shadow not starting back after a short ride,motorcycles,1626806177
6.0,Come test the water 😂,motorcycles,1626804852
7.0,Need help choosing between 2 pairs of boots.,motorcycles,1626803230
8.0,Miles,motorcycles,1626802840
9.0,I’m worried is 25k miles to much for my 14 R1?,motorcycles,1626802731
10.0,I recently bought a Chaparral ST100 and can't find anything on it other than a few forum posts.,motorcycles,1626801968
11.0,Beginner question,motorcycles,1626801223
12.0,"31 year old interested in getting into motorcycling, any advice?",motorcycles,1626801040
13.0,Don't leave home without your helmet.,motorcycles,1626799904
14.0,Question about purchasing Daytona 765 R Moto2.,motorcycles,1626799734
15.0,Question about carburetor tuning/rejetting after aftermarket exhaust installation,motorcycles,1626799148
16.0,[Q] Is seat gel in a heated seat possible/viable?,motorcycles,1626799015
17.0,Tips on running and looking after a 2003 sport bike&gt;?,motorcycles,1626797245
18.0,"Moderator /u/MisterShine, aka Neil, has sadly passed away.",motorcycles,1626795875
19.0,Where to mount GoPro?,motorcycles,1626795183
20.0,What MC is this?,motorcycles,1626793207
21.0,Ktm duke 390 vs yamaha mt-03,motorcycles,1626792991
22.0,83 honda cm250 oil change clutch slipping now.,motorcycles,1626792934
23.0,KTM RC 8C - 100 pieces - looks säxy AF :O,motorcycles,1626792801
24.0,Question about 2 finger clutching,motorcycles,1626792552
25.0,How old do you have to be to get a cruiser?,motorcycles,1626792278
26.0,Triumph Announces Coming Line of Motocross and Enduro Dirt Bikes,motorcycles,1626792126
27.0,Bunch of questions from a new enthusiast,motorcycles,1626791569
28.0,Garmin zumo xt help,motorcycles,1626790941
29.0,Anyone know how to replace a peg on a 2020 Yamaha R6?,motorcycles,1626790799
30.0,Downshifting process and use,motorcycles,1626790778
31.0,"New track only KTM sports bike unveiled. 128 Hp, 140 kg dry weight, limited to 100 units",motorcycles,1626790583
32.0,Anyone know how to change a foot peg on a 2020 Yamaha R6?,motorcycles,1626790323
33.0,"My motorbike was removed from my premises in Manchester on 21/06/21 It’s a red triumph speed twin 1200 MK21 XKC Can’t be too many of these about, any information leading to its recovery would be greatly appreciated.",motorcycles,1626788209
34.0,Engine will turn over but not start,motorcycles,1626787494
35.0,Is leaning really necessary?,motorcycles,1626787409
36.0,First Bike: 2021 Indian Scout Bobber. Took 10 long weeks for her to get here but it was well worth the wait.,motorcycles,1626786247
37.0,Finally getting a taste of the rolling stoppie! Feels higher up than it is 😂,motorcycles,1626785983
38.0,Question about Suzuki diagnostic ports,motorcycles,1626785700
39.0,An alternative reminder that a helmet has always been a good idea,motorcycles,1626785440
40.0,What one for beginner rider new to bikes .. 2 links just separate them,motorcycles,1626784770
41.0,Sound difference between MT-07/xsr700 and MT-09/xsr900.,motorcycles,1626784599
42.0,New rider with a new bike issue,motorcycles,1626783642
43.0,Triumph Motorcycle Riding Meet Up,motorcycles,1626783544
44.0,Bootleg or flare leg jeans,motorcycles,1626782268
45.0,Need help with motorbike mechanics,motorcycles,1626781898
46.0,Afraid of blowout. Can I still ride?,motorcycles,1626780312
47.0,Worried and intimated about being tall enough to ride Motorcycles,motorcycles,1626779759
48.0,Need help identifying this bike. 1994(?) Suzuki.,motorcycles,1626774467
49.0,"Turning signal problems, 93 dyna wide glide.",motorcycles,1626766891
50.0,What’s the fastest motorcycle and why?,motorcycles,1626766061
51.0,"What’s the fastest bike and why? between CBR 1000RR, ZX10/14RR, BMW S1000RR. Hayabusa or?",motorcycles,1626765979
52.0,Need help authenticating akropovic exhaust,motorcycles,1626765254
53.0,Gas Cap Lock Seized,motorcycles,1626764145
54.0,Disengaging clutch and relying on breaks or engine-breaking?,motorcycles,1626762739
55.0,Replacement parts,motorcycles,1626762092
56.0,Dropped my bike :( Should I be worried?,motorcycles,1626760591
57.0,[serious] leaning a motorcycle,motorcycles,1626759566
58.0,Ways to prevent theft on a bike with no lock mechanism,motorcycles,1626757978
59.0,How Are Extreme Riders Training?,motorcycles,1626757449
60.0,Good budget bike for beginner,motorcycles,1626756004
61.0,Seriously obsessed with the exhaust sound of my bike,motorcycles,1626754108
62.0,Female Motorcyle Clubs,motorcycles,1626753571
63.0,Motorcycle Insurance,motorcycles,1626751308
64.0,Anybody interested in riding in NJ?,motorcycles,1626751030
65.0,Insurance question,motorcycles,1626749495
66.0,Honda Super Cub,motorcycles,1626749277
67.0,Rear shocks setup help,motorcycles,1626747525
68.0,What's the consensus on wrecked/salvage bikes?,motorcycles,1626747198
69.0,Price for replacing fairings on a 2019 Suzuki GSXR-600?,motorcycles,1626747192
70.0,First highway ride,motorcycles,1626746959
71.0,"Bought bike yesterday, where do people keep helmet, registration or what kind of stuff do you take with you",motorcycles,1626746284
72.0,Drawback to 100w LED headlight,motorcycles,1626744679
73.0,"(Total noob moment) I’m a beginner and I’m still getting used to the clutch and my mistakes here is i came to a complete stop in 3rd gear and didn’t hold the clutch. I also know that I’m lacking gear so spare me as I’m planning on buying jacket, boots and etc.",motorcycles,1626744292
74.0,"Helmets for jay leno chin, go!",motorcycles,1626743888
75.0,Longest day trip so far,motorcycles,1626743798
76.0,Not sure how describe this besides “discontinued motorcycle factory in operation”?,motorcycles,1626742833
77.0,Anyone here into stunt riding?,motorcycles,1626742442
78.0,Front suspension hybrid proposal,motorcycles,1626742357
79.0,Where to find parts?,motorcycles,1626740680
80.0,Purchasing from dealers &amp; fees,motorcycles,1626740082
81.0,Rate me,motorcycles,1626739426
82.0,Ducati Streetfighter V4S Umbau,motorcycles,1626739139
83.0,What is the best country for a 7-day spontaneous motorcycle trip abroad?,motorcycles,1626738937
84.0,Best country for a spontaneous 7-day motorcycle trip abroad??,motorcycles,1626738885
85.0,Ducati Streetfighter V4S Umbau,motorcycles,1626738769
86.0,When do MSF courses become easier to enroll in?,motorcycles,1626737406
87.0,Shops in Denver that you recommend for wheel alignment and fork oil/seal change?,motorcycles,1626737368
88.0,"Hands going numb when riding, anyone else?",motorcycles,1626737022
89.0,"Hands getting numb when riding, think my gloves causes it",motorcycles,1626736723
90.0,Goons on ADV bikes and a Muddy MX track dont mix!,motorcycles,1626736326
91.0,What Motorcycle to buy,motorcycles,1626735956
92.0,Anyone know why it sounds like this? Looking into buying this bike and fixing it up a bit.,motorcycles,1626735612
93.0,"""pinging"" or ""knocking"" sound started occurring on Ninja 250r?",motorcycles,1626735561
94.0,Vintage info for the Crocker V-twin,motorcycles,1626734833
95.0,Why are Hypernaked so popular?,motorcycles,1626733979
96.0,Riding in the rain. Enjoy!,motorcycles,1626733840
97.0,$5000 bike,motorcycles,1626733266
98.0,99 GSXR 600 engine/tranny noise need help,motorcycles,1626732651
99.0,99 GSXR 600 need help with engine/tranny noise,motorcycles,1626731582
,Just wondering about older bikes,motorcycles,1626730529
,99 GSXR 600 help with transmission noise,motorcycles,1626730455
,dropped plastic in oil tank. PLEASE help.,motorcycles,1626730433
,Looking for advice from experienced riders,motorcycles,1626730413
,Why does everybody buy the BNW gs 1250 and not the 750 or 850,motorcycles,1626727212
,Riding practice on wet roads?,motorcycles,1626727040
,Mental Block in Downshifting,motorcycles,1626725689
,CBR 600rr vs Tail of the Dragon (up),motorcycles,1626723423
,Back it in on wet road?,motorcycles,1626723253
,1983 Suzuki Tempter GR650 Gearing too low,motorcycles,1626723160
,How Do I Get Over My Fear from Crashing?,motorcycles,1626722912
,What happened to r/motorcycles?,motorcycles,1626722017
,What to do?,motorcycles,1626721459
,Motorcycle and nonmotorcycle owner e-bike design survey,motorcycles,1626721279
,Cranks but won’t start,motorcycles,1626721046
,gotcha reply guys have entered r/motorcycles,motorcycles,1626720926
,glad to see gotcha reply guys are here on r/motorcycles too,motorcycles,1626720750
,glad to see condescending gotcha reply guys are here on r/motorcycles too,motorcycles,1626720692
,We made this video for our new streetwear clothing brand Freezing Clothing. Check out our Instagram and let me know what you think!,motorcycles,1626719921
,"Keep dropping bikes, discouraged and thinking of quitting riding",motorcycles,1626719765
,Trimming a back protector,motorcycles,1626718544
,Need help!,motorcycles,1626718502
,Like I'm new to bikes kinda so idk😔,motorcycles,1626718038
,I FINALLY Bought My Dream Bike!!!,motorcycles,1626718032
,Is a Kawaski Ninja 400 good 4 a starter bike🤔 Like I have legit ridden in the past but only on my friends bike. Legit Never had my own and legit only rid a cpl times. But like I kinda wanna 650 or 1000 but I dont wanna die so idk lmao my friends say get a650 but like I want lots of answers.,motorcycles,1626717447
,"I’ve been trying to get this bike to work for months, I’m completely new to motorcycles and when I bought it it started up good and ran fine. Now it has a really hard time starting up, dies every time I try to let it idle, and I’ve already replaced the battery. Please help",motorcycles,1626717185
,"My Suzuki Katana at some twisties after first service, stiill in brake in period.",motorcycles,1626717063
,Rate me pls,motorcycles,1626716508
,wEaRs yOuR mASK sQuiD!¡?,motorcycles,1626716013
,Disc Lock Reminder Motorcycle Accessories By Lock Mate Key,motorcycles,1626715576
,What are avoidable scenarios beginners should practice for in advance?,motorcycles,1626715206
,What are avoidable scenarios beginners should practice for in advance?,motorcycles,1626715123
,Can you list avoidable scenarios beginners should practice for in advance?,motorcycles,1626715075
,I know guys i am not wearing gloves and gears in the Video but i usually do ! (I don't have waterproof gloves). Here i am trying to rev me little bike in my crazy country. I hope you guys how it's like to be here.,motorcycles,1626715072
,Can you list avoidable accidents a beginner should be aware of (to practice for in advance)? E.g. stalling a bike on an uphill and hitting a car behind,motorcycles,1626714715
,Would you get a hybrid motorcycle?,motorcycles,1626714274
,Podcasts?,motorcycles,1626713006
,Anti-Theft,motorcycles,1626713002
,"Advice: Folding pegs for rearsets, can't find much other than generic ebay/amazon units",motorcycles,1626711951
,"How do you learn to tune a suspension setup across diff bikes with diff riding styles and rider weights? Is it an art, or is their some math and some course or material that is the Go-To to become an expert ?",motorcycles,1626710806
,Figure eights on gravel,motorcycles,1626710697
,Best motorcycle helmets?,motorcycles,1626710461
,Advice for beginners?,motorcycles,1626710029
,KLIM helmet : what is the difference between Klim Krios Pro Arsenal and Klim Krios Pro (Black),motorcycles,1626708910
,KLIM helment : what is the difference between Klim Krios Pro Arsenal and Klim Krios Pro (Black),motorcycles,1626708864
,⭐️Stickers⭐️,motorcycles,1626708279
,Limited speed during break-in of new Motorcycle?,motorcycles,1626707220
,"Fellow directionally challenged riders, Dedicated GPS (Garmin/Tomtom) or phone with mount?",motorcycles,1626707163
,What are good metrics to measure your ability to safely operate a motorcycle as you age?,motorcycles,1626707013
,Tips for eaiser search of parts,motorcycles,1626706483
,I’m in a contest to win a chopper designed by OCC. I decided to dedicate it to Human Trafficking Awareness. Would love your vote! This could be a huge way to raise awareness for a horrible industry.,motorcycles,1626706477
,is the new Kawasaki ZH2 a good bike for brand new rider?,motorcycles,1626706250
,is the new Kawasaki ZH2 a good beginner bike?,motorcycles,1626706192
,NY state motorcycle helmet laws allow half helmets?,motorcycles,1626705811
,"A Dutch motorcycle police officer was killed by a truck driver 2 weeks ago, a special funeral was organized by the Dutch police",motorcycles,1626705564
,Is there any place in the US to buy a retro/classic-styled 125cc bike like the ones common in Europe and the UK?,motorcycles,1626704250
,What are the pros and cons of duke 390,motorcycles,1626703818
,What are the pros and cons of duke 390?,motorcycles,1626703602
,"Need help, is there supposed to be oil here? (Magneto cover)",motorcycles,1626703162
,Highways are rough,motorcycles,1626703058
,Fuse question 15a fuse -&gt;20a fuse,motorcycles,1626702470
,CBR 600RR vs Tail of the Dragon (Down),motorcycles,1626702129
,Seeking Advice...,motorcycles,1626701777
,Help!,motorcycles,1626700922
,Good twisties or noob-friendly tracks in NJ?,motorcycles,1626700878
,RevZilla is updating &amp; cheapening their ZillaCash Program,motorcycles,1626700507
,"Research motorcycle products (If this is not allowed, please delete this post)",motorcycles,1626699540
,Does Anyone know of any bigger Bike Nights in Florida?,motorcycles,1626699530
,Tips for cleaning exhaust pipe?,motorcycles,1626697857
,Tips for cleaning exhaust pipes?,motorcycles,1626697413
,CB400ss Mystery,motorcycles,1626695120
,Motorcycle creaks at low speeds after getting serviced.,motorcycles,1626694345
,Purchase Advice Superthread,motorcycles,1626692418
,"New passenger. I was little bit shocked, he as well.",motorcycles,1626691850
,How long are motorcycle helmets good for?,motorcycles,1626691477
,Open-world Motorcycle game! Make it happen.,motorcycles,1626689606
,Here is a recent interview with new Norton CEO Robert Henschel that I just discovered.,motorcycles,1626689192
,Personal and work,motorcycles,1626687559
,"Stay safe out there. I nearly lose my head, and I'm an idiot.",motorcycles,1626685946
,"Anyone else ""biked down""?",motorcycles,1626684840
,why the hell is my scooter wanting to run a 95 main jet,motorcycles,1626683191
,Spark plug OK to use? Spark plug dropped into spark plug chamber during install.,motorcycles,1626681040
,is the 2021 GSX-R750 not for sale in the US?,motorcycles,1626677899
,pro motorcycle shipping services,motorcycles,1626674651
,"i know y’all get this question a lot but, How dangerous are motorcycles?",motorcycles,1626674517
,"Are there any tools, equipment or knowledge I need before changing my tire?",motorcycles,1626674078
,Ruroc helmet,motorcycles,1626673226
,Can someone please answer this question for me??,motorcycles,1626669580
,Went bike shopping (looking) this weekend.,motorcycles,1626668497
,Bimmer said hello!,motorcycles,1626668122
,Need help troubleshooting,motorcycles,1626668006
,"13k miles under my belt, and I still love my 300!",motorcycles,1626667943
,Crankshaft Procedure for timing chain,motorcycles,1626667940
,The Double Yellow Line,motorcycles,1626667916
,When to upgrade from learners bike?,motorcycles,1626667880
,What's the worse that can happen,motorcycles,1626667693
,"I'm not as fast as many here, but I really want to show off how awesome Taiwan is for motorcycling: a ride from Taipei to Wulai",motorcycles,1626667074
,Passengers on a learner's licence,motorcycles,1626666344
,Question about passanger,motorcycles,1626666256
,Repost: Wings on vest offensive?,motorcycles,1626666211
,Is an MT-07 a good first bike?,motorcycles,1626666128
,Mt09sp vs mt10?,motorcycles,1626665760
,"[HELP] saw these disconnected hoses, should I be worried?",motorcycles,1626665120
,"Question, know what this helmet is?",motorcycles,1626664881
,Trying to make the best of a crappy NE Wisconsin road on my way home from work!,motorcycles,1626664053
,On a road trip in Idaho,motorcycles,1626663684
,Had to lay her down,motorcycles,1626663460
,New to motorcycles.,motorcycles,1626663377
,Rear brake pedal pushes back when I brake hard..,motorcycles,1626663074
,What are ways to ensure no damage for a dropped bike while practicing?,motorcycles,1626662560
,Any tips going from first to second gear?,motorcycles,1626662556
,Rear tire doesn't spin / Rear brake is tighter than it's supposed to be,motorcycles,1626661028
,Had a weird encounter today,motorcycles,1626660815
,Anyone have a 2021 nmax125 ? Just order one … anything I should now ?,motorcycles,1626660482
,Two Piece Track Suit Size Question,motorcycles,1626659282
,Riding from LA&gt;Seattle. Looking for any tips or recommendations. Thanks,motorcycles,1626658749
,What make/model of Yamaha is this?,motorcycles,1626658414
,2007 Yamaha R6 Fan Not Working,motorcycles,1626658242
,"2007 Yamaha R6 Fan Not Working, Fuses are good, any idea what it could be?",motorcycles,1626658027
,300 vs 650,motorcycles,1626657516
,Racer Gloves finger length,motorcycles,1626656465
,83 Honda 250cm,motorcycles,1626656146
,Does anyone know what the cruising revs are for a 07 gsr600,motorcycles,1626654927
,Things to look out for in buying a used motorcycle,motorcycles,1626653298
,ignition coil questions,motorcycles,1626652305
,1980 cm400,motorcycles,1626651580
,Retaining skills while away at college,motorcycles,1626651532
,High quality non-leather summer-fall gloves,motorcycles,1626650867
,To risky for my liking but still pretty cool,motorcycles,1626649287
,"My temporary plate expired but my actual plate hasn’t arrived yet, how can I get an extension until it comes?",motorcycles,1626649009
,"My temporary plate expired but my actual plate hasn’t arrived yet, how can I get an extension until it comes?",motorcycles,1626648941
,2022 BMW S1000RR,motorcycles,1626647711
,"Is my brake fluid level too high? I don’t see a max line or anything, the rear reservoir is fine it is between the lines but considered about this front one while doing my 600 mile service on sv650. Thanks",motorcycles,1626646802
,Ride your own ride. Don't let your friends take you out of your skill level.,motorcycles,1626646633
,"Hi Yall, Give a Noob Some Advice...",motorcycles,1626646583
,Is a hyabusa a good beginner bike?,motorcycles,1626643654
,Is a hyabusa a good beginner bike?,motorcycles,1626643283
,Are 125cc seats uncomfortable?,motorcycles,1626643220
,Dad finds kidnapped son after 24-year search on motorcycle,motorcycles,1626641954
,Can anyone identify this helmet?,motorcycles,1626641920
,Not sure which one to get 07-08 ZX-6R or 09-12 ZX-6R,motorcycles,1626641900
,[CBR500R] I filled the oil as much as the manual said I should after an oil/filter change but the gauge on the side looks like it's barely filled.,motorcycles,1626640847
,2015 KTM RC390,motorcycles,1626639679
,1-10 how reckless?,motorcycles,1626639424
,New rider looking for help 🏍,motorcycles,1626639361
,Need advice on what to do with arecently crashed 125cc Bike and how to cope with the crash after-effect.,motorcycles,1626639234
,New rider looking for help,motorcycles,1626639223
,New rider 🏍,motorcycles,1626639113
,Suggestions ?,motorcycles,1626638975
,Lean Drifts,motorcycles,1626638826
,Seat for vstrom 650,motorcycles,1626638185
,Had a buddy along for the ride,motorcycles,1626636095
,What's causing this?,motorcycles,1626636045
,S&amp;S Compression Releases,motorcycles,1626635456
,"Sinnis hoodlum leaking rear absorber, safe to ride?",motorcycles,1626635422
,"I love sport bikes, but I hate the type of people they attract",motorcycles,1626635348
,Speedometer needle position...,motorcycles,1626634911
,"Caliper piston, too much damage?",motorcycles,1626632568
,'01 Fatboy &amp; '02 Heritage fork swap dilemma.,motorcycles,1626632125
,Left hand down with two fingers out?,motorcycles,1626630795
,Any Cardo or Sena employees here?,motorcycles,1626630454
,Removing the Topspeed-Limiter of the Honda SC82,motorcycles,1626629984
,Any Cardo or Sena employees on here?,motorcycles,1626629958
,"Rotational rear end grinding, anyone know what it could be?",motorcycles,1626628806
,Have you ever seen anything particularly stand out or funny while riding?,motorcycles,1626628729
,How big of a chance of a crash damaging my hands/giving nerve damage to them?,motorcycles,1626628718
,Motorcycle dealerships are so much better then car dealerships.,motorcycles,1626628573
,How bad is this? New to bikes…,motorcycles,1626628370
,Honda XL175 1976 Shop Manual Resource?,motorcycles,1626626972
,Are Bogotto helmets good?,motorcycles,1626625595
,The Shoei GT Air II ratchet strap...,motorcycles,1626625370
,is a bill of sale enough to register a bike? located in california,motorcycles,1626625241
,Could anyone identify what this chattering noise is from the rear of my bime? I'm not sure but I don't think its the chain skipping because under super hard acceleration it doesn't do this. It only happens under heavy braking esspecially after hit the brake to bring the front end down,motorcycles,1626625096
,"CB650R on Mt. Hamilton, CA",motorcycles,1626624828
,"Riding for 48 hours through the Peloponnese, in Greece. From crystal clear sea to twisty mountains to ancient sites, all within few hours from one another.",motorcycles,1626624073
,Throttle cable is really loose on my Harley Davidson softail will this effect my bike and can I fix this?,motorcycles,1626622469
,"Dual sport line up, North East India",motorcycles,1626622048
,Riding before endorsement?,motorcycles,1626621727
,On a long haul to nowhere on country roads my CB900C blew an exhaust valve. Thought this would be the end of my season but then got determined to ride again. REPAIRS ARE UNDERWAY,motorcycles,1626620714
,New (old) bike carb,motorcycles,1626620417
,Anyone here work for Cardo or Sena?,motorcycles,1626619744
,copart bike restoration help?,motorcycles,1626618938
,"Startup problem, Any help greatly appreciated =)",motorcycles,1626618430
,Question: riders who hang their helmet on their handlebars - have you ever had someone mess with it?,motorcycles,1626616933
,Any perfomance difference between a 125cc sports bike and 125cc scooter?,motorcycles,1626615988
,Motorcycle restauration,motorcycles,1626611600
,Second bike for a beginner,motorcycles,1626610714
,Is it bad to switch gears when u dont fully pull the clutch in?,motorcycles,1626610673
,Acceptable passing?,motorcycles,1626610376
,My ride on Jawa 42 !!!,motorcycles,1626609005
,What is change gears for?,motorcycles,1626607203
,Changing road bike inner tube. Honda cb250 nighthawk 1998,motorcycles,1626606762
,White smoke coming from oil filter after changing,motorcycles,1626605370
,bike price in nepal,motorcycles,1626600722
,new bikes in nepal,motorcycles,1626600585
,"Hello, i have one question about my yamaha wr 125cc 2010.",motorcycles,1626600404
,"Hello, i have one question... at my yamaha wr 125 x 2010 the stator it is broken, can i take a stator from an yamaha xmax125 and to put it on my wr 125?",motorcycles,1626599683
,Help me understand closing the throttle,motorcycles,1626599588
,"Hello, i have one question... at my yamaha wr 125 x 2010 the stator it is broken, can i take a stator from an yamaha xmax125 and to put it on my wr 125?",motorcycles,1626599532
,Need advice on my third bike. 1000cc too much?,motorcycles,1626598940
,Owning the road,motorcycles,1626597989
,Population and Environment,motorcycles,1626596003
,Coronavirus face masks an environmental disaster that might last generations,motorcycles,1626595993
,Do Your Duty To Keep Nature A Beauty- World Rainforests,motorcycles,1626595982
,World Day to Combat Desertification and Drought- 17 June,motorcycles,1626595971
,Ecological Footprint and Bio capacity Deficit,motorcycles,1626595957
,"World Environment Day 2021-Reimagine, Recreate, Restore",motorcycles,1626595946
,30 by 30 Global Initiative,motorcycles,1626595934
,Indian Covid Threat for World,motorcycles,1626595923
,G7 ministers agree on new measures against fossil fuels in response to climate change.,motorcycles,1626595910
,"Social vulnerability, Food insecurity and Climate change",motorcycles,1626595891
,Plastic in the oceans,motorcycles,1626595877
,Enjoying a Motorcycle 🏍,motorcycles,1626594054
,anyone run stunt cages on their street bike? whats your opinion of em?,motorcycles,1626593809
,What are some 125cc cruiser bikes that I can resell for close(ish) to what I payed for?,motorcycles,1626593736
,Best Motorcycle Fairing Speakers (Review and for Music),motorcycles,1626590115
,Best Motorcycle Fairing Speakers (https://www.youtube.com/watch?v=MEcwF9MGOVU&amp;t=9s),motorcycles,1626590082
,Best Motorcycle Fairing Speakers (Review and for Music),motorcycles,1626586583
,New rider: Stupid question,motorcycles,1626584582
,Is it worth replacing my replica exhaust with a real one?,motorcycles,1626583419
,Benefits of centrifugal clutch motorcycle,motorcycles,1626582677
,"Bike stolen, curious how much to expect my insurance premiums to rise?",motorcycles,1626581630
,Hot start issue,motorcycles,1626580993
,Recommendations for budget intercoms?,motorcycles,1626578924
,Need Advice/Guidance on purchasing a motorcycle.,motorcycles,1626577978
,Motorcycle transmission whine,motorcycles,1626577428
,Guy wanted to follow me,motorcycles,1626577083
,Motorcycle Endorsement Question,motorcycles,1626574220
,Looking at buying 2002 Suzuki Volusia Intruder,motorcycles,1626573527
,Zx636 vs cbr600rr,motorcycles,1626573025
,What’s a good price for 09 r6 single owner 8k miles?,motorcycles,1626572567
,Sedici Strada II Animale Helmet,motorcycles,1626572052
