Unnamed: 0,title,subreddit,created_utc
,"Almost rode into a ""chain trap"" in the forest today.",motorcycles,1623688776
,KTM DUKE 125 - AUSTIN RACING EXHAUST,motorcycles,1623688680
,(Rookie rider) When you have to brake fast do you hold the clutch in and stay in gear or lower gears for engine brake?,motorcycles,1623685814
,Replacement for Dunlop Q3+ in 2021,motorcycles,1623685658
,Discord,motorcycles,1623684975
,helmet fits snug but on highway with wind pulls it back? too big?,motorcycles,1623684705
,2005 Rm 250 Frame up Rebuild. Progress pictures-complete.,motorcycles,1623684576
,What’s the deal with Toce exhaust systems?,motorcycles,1623684353
,just noticed my oil gauge window is filled to the top..? is it safe?,motorcycles,1623684114
,"Need some help figuring what's going on with my bike. 2006 vulcan 900 classic, it's jas cobra pipes, cobra intake, and a cobra tuner",motorcycles,1623683590
,1979 xs 1100 bought the bike as a cheap barn find and was gonna ride it till it died... Hit a deer on it and then decided to rebuild as a cafe . im still new to mechanical work i got some questions in the comments,motorcycles,1623682615
,Motorcycle chest protector,motorcycles,1623682253
,Looking for music options,motorcycles,1623682030
,First time buyer,motorcycles,1623680949
,Rubbing sound when riding - Kawasaki Z750 2005,motorcycles,1623680214
,Helmets with better ventilation than the Schuberth C3 PRO,motorcycles,1623676362
,"Decided I Didn’t Like the Giant Halogen Light, so I Swapped it for an LED One (Before and After)",motorcycles,1623676194
,Smart Lock,motorcycles,1623675498
,Should I buy a Victory in 2021,motorcycles,1623675360
,Is something wrong with my bike?,motorcycles,1623675165
,"Engine backfired, sputtered and died. Lost all electrical power. What could cause this?",motorcycles,1623673439
,Family Still Seeking Justice for Fallen Motorcyclist,motorcycles,1623671721
,Taking the Yamaha MT-09 on a ride through Skålhamra,motorcycles,1623671058
,Purchase Advice Superthread,motorcycles,1623668417
,SMART SOLUTIONS THAT WILL HELP YOU EASILY DIAGNOSE YOUR CAR FOR PROBLEMS,motorcycles,1623667283
,Compulsory Basic Training,motorcycles,1623665794
,Does anyone know what kind of bike this is?,motorcycles,1623663401
,"I’m 4’11, am I able to fit on bikes with a ~30” seat height?",motorcycles,1623659652
,New rider here looking for wisdom,motorcycles,1623659397
,New rider here,motorcycles,1623658972
,Curious about its sound any thoughts on what yall think is wrong? Anything helps,motorcycles,1623656197
,A detailed review of whether you should buy street 750/ xg 750 @harleydavidsonrules,motorcycles,1623654566
,Why Electric Motorcycles do not have gears?,motorcycles,1623653071
,Permit Test,motorcycles,1623652441
,If I wear a triumph motorcycle jacket when riding my Honda CB125 are other riders gonna judge me?,motorcycles,1623647194
,short rider,motorcycles,1623645235
,Bikes for short rides,motorcycles,1623645002
,Bike recovered,motorcycles,1623644413
,Why does a high end brand like Dianese only use Level 1 armor in most of their gear? Any suggestions for alternatives for upgrading it that fit perfectly?,motorcycles,1623643394
,I'm puzzled and hoping someone has a good suggestion,motorcycles,1623641416
,"Yamaha R3 x Boston, MA",motorcycles,1623640875
,Bike making ticking sound (like baseball card in spokes) this normal? Harley,motorcycles,1623640342
,Is it okay to ride my bike without the frame bolt?,motorcycles,1623639979
,"Are there inline fuel filters with compression nut and ferrule fittings for 1/4"" OD metal fuel lines?",motorcycles,1623639845
,How difficult would you guys consider changing the oil on forks to be ?,motorcycles,1623639674
,Is my motorcycle stock??,motorcycles,1623639014
,Why does a belt cause motorcycle to lose some of the power its putting down?,motorcycles,1623638988
,Just got my first bike!,motorcycles,1623636309
,Does this mean cortech is bad or good?,motorcycles,1623635077
,99 Honda Valkyrie Interstate Rear Rotor question,motorcycles,1623634719
,Thats not a Grom - My New Motorcycle!,motorcycles,1623634415
,My Newest (Unintentional) Project,motorcycles,1623631217
,Triumph 675 Daytona Backfire,motorcycles,1623630445
,Recently picked up a 2020 Triumph Tiger 1200 and now waiting to adding panniers and upper crash bar,motorcycles,1623630199
,New to carbs,motorcycles,1623629642
,Is it a bad idea to sell my car and buy a bike?,motorcycles,1623629529
,Is it a bad idea to sell my car and buy a bike?,motorcycles,1623629488
,Helmet Death Wobble?,motorcycles,1623628907
,Best starter bike?,motorcycles,1623628905
,Should I or can I bend my windscreen,motorcycles,1623628752
,I need ur guys' advice,motorcycles,1623628138
,Are motorcycle top cases interchangeable with mounts from different companies?,motorcycles,1623625547
,Dual Sport/Enduro recommendations,motorcycles,1623624555
,"Motorcycling isn't always blue skies and twisties. Sometimes it's dragging your ass down the highway in the rain, four states from home.",motorcycles,1623624544
,"Huge motorcycle fan, offroad and street, how difficult would you say it is to get a class M license?",motorcycles,1623624341
,"Hey guys, I'm looking for some assistance.",motorcycles,1623624283
,"Any enduro/dual sport, bikes that I should look at for a first bike, 250cc or 125cc is prefect. Thanks a lot",motorcycles,1623624243
,"Just got into riding but after riding on the street, I'm thinking it's not for me.",motorcycles,1623623782
,WCGW when the throttle got stuck.,motorcycles,1623621398
,Honda CBR600 F3 - Air Solenoid Delete?,motorcycles,1623621090
,"How common is 75mph + wobble, and what can be done about it?",motorcycles,1623621085
,Horn recommendations,motorcycles,1623621014
,How to make my moped faster,motorcycles,1623620886
,CBR600 F3 - Air Solenoid Delete?,motorcycles,1623620766
,Trying to figure out why my tire feels wobbly in front,motorcycles,1623620549
,I think my motorcycle engine is confused about how many cylinders it has.,motorcycles,1623620409
,Man vs. Leaky Fuel Petcock,motorcycles,1623620251
,Aspiring motorcycle owner,motorcycles,1623620240
,Couldn’t hold my excitement in but finally getting the hang of this foot brake,motorcycles,1623619950
,Is this noise normal after a fifteen minute ride?,motorcycles,1623618456
,Pre-2006 cams,motorcycles,1623618290
,"Say, you had 20 grand to spend on a motorcycle!?",motorcycles,1623617945
,Does the 2011 Aprilia SX50 have OBD?,motorcycles,1623617740
,Need help finding specific style of grips,motorcycles,1623617286
,Helmet Skirt vs New Helmet,motorcycles,1623616964
,Just passed my MSF class in Florida,motorcycles,1623616574
,YOLO!!!!,motorcycles,1623616559
,Chasing a stunt biker with an FPV drone,motorcycles,1623615775
,1987 Honda magna first bike?,motorcycles,1623615260
,Mini sport bike options for 8 year old,motorcycles,1623614821
,Why I think dual sports are the best secondary bike. They are a blast,motorcycles,1623614688
,Need help identifying bike?,motorcycles,1623614299
,Kx 250f,motorcycles,1623614286
,Advice needed - UK Indoor parking,motorcycles,1623614083
,Motorized Bikes,motorcycles,1623614004
,Gorgeous day for a ride. (VFR800/RC46 NC),motorcycles,1623613844
,What age did most of you get your first bike and what was it?,motorcycles,1623613828
,"Is Oceanside, CA biker friendly?",motorcycles,1623613809
,05 Hayabusa Slipping,motorcycles,1623613600
,Numb foot - causes &amp; suggestions?,motorcycles,1623612798
,can a motorcycle be too heavy or does it all depend on the rider and experience,motorcycles,1623612289
,"We don't have canyons or mountains, but we do have enjoyable country roads",motorcycles,1623610216
,Dealership experience - rant/seeking advice,motorcycles,1623608497
,New Harley Fat Bob front wheel just started clicking with 250 miles on the bike. Any ideas?,motorcycles,1623608351
,First bike.. CBR500r,motorcycles,1623608155
,Quick Shifters... What am I not understanding?,motorcycles,1623607988
,Kawasaki versys 650 or Yamaha tracer 700?,motorcycles,1623607301
,Biker meets sky glider,motorcycles,1623607271
,Changing lanes. Do you ever turn your head to see traffic on other lanes?,motorcycles,1623606697
,Too often has the cloak of diplomatic immunity been used to shield perpetrators from justice.,motorcycles,1623606539
,"I'm 16, 5'11 and want to buy my first sport bike. What will get me into the least amount of trouble base on the options below? Note: I would still like to be able to keep up on highways without feeling overwhelmed by other motorists.",motorcycles,1623606178
,How can I prevent my bike from being stolen?,motorcycles,1623605793
,2021 House of Harley Law Enforcement Ride,motorcycles,1623603824
,Engine failure after purchasing from dealer and 800 miles. What should I do?,motorcycles,1623603459
,What’s a good helmet for blocking wind noise that allows me to wear AirPods comfortably?,motorcycles,1623602603
,Is a Honda Shadow a good beginner bike??,motorcycles,1623600329
,Help,motorcycles,1623598636
,Just a hair to tall for my 2006 Honda shadow; is it possible to get a new seat that will put my butt a few inches back?,motorcycles,1623598268
,Never give up,motorcycles,1623597821
,Need repair advice,motorcycles,1623597506
,Need help triggering turn lights at intersections (US),motorcycles,1623596480
,Need advise,motorcycles,1623596314
,Heel toe shifter,motorcycles,1623595479
,Leather Keychain Pouch,motorcycles,1623594949
,Wheelies,motorcycles,1623594538
,VMax shifting question,motorcycles,1623594536
,Harley-Davidson Livewire Review,motorcycles,1623594041
,What do you do with your gear once you've arrived at your destination?,motorcycles,1623593878
,Purchase help??,motorcycles,1623593407
,What skill level should I be at after passing?,motorcycles,1623592991
,Duke 390?,motorcycles,1623591806
,Starting a Motovlog. Open to friendly feedback and tips. Thanks,motorcycles,1623590511
,Wheels Two Fun Coming This Summer. What The ...,motorcycles,1623588890
,Wheels Two Fun - B ROLL WITH COMMENTARY,motorcycles,1623588808
,"Finally, someone was home",motorcycles,1623588206
,What Motorcycle should be my first?,motorcycles,1623587815
,Wake up sunshine 🌞🌞🌞🌞,motorcycles,1623587060
,monster 2003 ie 620 - APTC clutch?,motorcycles,1623587020
,GPS route maker?,motorcycles,1623586806
,New Triumph Rocket 3 Touring Owner,motorcycles,1623585485
,"Silly question, but can any motorcycle inspection station inspect any bike brand?",motorcycles,1623584215
,"Sound test Aprilia Tuono Factory, what do you guys think?",motorcycles,1623583105
,What are the best motorcycle helmets for women in 2021,motorcycles,1623582281
,F &amp; T on stator rotor,motorcycles,1623580023
,Yamaha yzf-r125 exhaust,motorcycles,1623577847
,Kurztour rund um Horb &amp; Sulz am Neckar,motorcycles,1623574741
,Disappointment,motorcycles,1623572734
,My MSF class today was bittersweet. Looking for some advice.,motorcycles,1623572409
,I'm sick of people mocking me about my 2020 Ninja 400. I think it's time for some savage comebacks,motorcycles,1623571527
,I'm sick of people mocking me about my 2020 Ninja 400. I think it's time for some savage comebacks,motorcycles,1623571268
,People make jokes about my 2020 Ninja 400 and I need help.,motorcycles,1623571028
,Why the black windscreens?,motorcycles,1623570735
,BMW R nineT Scrambler VS Honda CB1000R,motorcycles,1623570184
,c70 passport engine replacement: SOMEONE CLEAR THIS UP!? GOING CRAZY HERE,motorcycles,1623568130
,opinions on my second bike,motorcycles,1623567158
,Damage found after closing on a used motorcycle from a dealership,motorcycles,1623566510
,Dirt ride planned for next week and it's expected to be 105-110°,motorcycles,1623563157
,Ducati 797,motorcycles,1623563009
,Looking for a motorcycle to get…but what?,motorcycles,1623562578
,Questions about my odds of being approved to finance a new ninja 400.,motorcycles,1623561502
,What do you do with old helmets?,motorcycles,1623560704
,How much can I count on sides of new helmet loosening with time?,motorcycles,1623559777
,Question about sprocket size,motorcycles,1623559712
,I'm getting my license soon so which bike should i get?,motorcycles,1623559148
,Clutch up wheelie,motorcycles,1623558624
,Battery pigtail question,motorcycles,1623558536
,Time to go,motorcycles,1623556580
,Do brake lever locks damage the brakes?,motorcycles,1623556407
,Do brake lever locks damage the brakes?,motorcycles,1623556203
,Programming the Scorpio Maverick...,motorcycles,1623554048
,‘21 Yamaha mt07 blackwidow full exhaust baffle out no tune yet follow my ig for more posts @LoudWhipz #yamaha,motorcycles,1623549873
,My new ride - 2020 Yamaha Tracer 900 GT! Ready for some touring!,motorcycles,1623549813
,re int650 or sv650,motorcycles,1623549420
,First time dragging knee.,motorcycles,1623549108
,i love my 21 z650,motorcycles,1623548059
,Need bike recommendations!,motorcycles,1623548026
,1997 Kawasaki ninja zx-11 vs 2000 Honda cbr600f4,motorcycles,1623547987
,1999 SV650 Stater issues?,motorcycles,1623547698
,"Break in, I lugged a few times! Oh no? Or just don’t keep doing itn",motorcycles,1623546596
,UK A2 course,motorcycles,1623546304
,Fundraiser by Shaun Sanders : Funeral expenses for Cody Robinson,motorcycles,1623546194
,interceptor 650 or sv 650 as a first bike,motorcycles,1623545803
,A big thunderstorm caught me!,motorcycles,1623545737
,Where to keep motorcycle not allowed at home,motorcycles,1623543163
,"Slip on exhaust install, issues...",motorcycles,1623540296
,Insurance before buying?,motorcycles,1623539872
,What could possibly go wrong?,motorcycles,1623539379
,Is it just me or do bikes seem to randomly slip and crash for no real reason?,motorcycles,1623538916
,Cicadas tried to Mate with my KTM,motorcycles,1623538815
,Royal Enfield,motorcycles,1623538673
,How hard is it to ride a motorcycle if you’ve never ridden a bicycle?,motorcycles,1623538289
,Looking for ADV pants,motorcycles,1623537942
,Can a 50cc engine develop more than 45 kmh?,motorcycles,1623536708
,HOA restricts sheds. Storing bikes?,motorcycles,1623535027
,Motorcycle Maintenance,motorcycles,1623533730
,Kawasaki ninja 400,motorcycles,1623533195
,2020 Ninja 400,motorcycles,1623533061
,Motorcycles on the Autobahn,motorcycles,1623532073
,When downshifting. Do you know at x speed i need to be in x gear? If im coming to a full stop its easy just click down all the way to 1st. But anything else is sketchy im a bit scared ill engine brake hard.,motorcycles,1623531759
,Changing tires by myself,motorcycles,1623531376
,For those saying girls don't care about motorcycles...,motorcycles,1623530841
,I hope you enjoy this clip of me cruising this beautiful road on my KTM 790,motorcycles,1623530574
,Are gas tanks not waterproof from the outside? Washes my tank and noticed some water went inside.,motorcycles,1623529684
,"Alright gang, what’s the problem here? Bad Solenoid?",motorcycles,1623528674
,Tire run out,motorcycles,1623528500
,First time ridind my bike today(Svart 401). Noticed some things and wanted to ask if these are things to worry about. I bought it used with 1k miles on,motorcycles,1623527671
,"I've been lurking for a year, and I FINALLY have something of my own to share, my first time outside my neighborhood!",motorcycles,1623526215
,New rider,motorcycles,1623525550
,First time laying bike down,motorcycles,1623525468
,MT-10 Hindle 3/4 exhaust sound test with and without the quiet insert,motorcycles,1623524873
,Shoei CWR-1 visor question,motorcycles,1623524289
,"Good morning, I have a 2012 Rebel 250. I cleaned the carb and put everything back together. It will start, however when I give i increase the throttle it will die out. Any suggestions for a fix? Thanks",motorcycles,1623524262
,"Honda shadow 750, tire feels wobbly!",motorcycles,1623524000
,2009 Sportster 1200L Low Wobble at all speeds,motorcycles,1623523779
,So I’m about to do some sketchy shit,motorcycles,1623522810
,Buddy got a bike and is new to riding. Gonna ride with him on non HW roads. Tips?,motorcycles,1623522562
,Kawasaki 450 died,motorcycles,1623521901
,I Accidentally Tipped Over a Vespa. He wants A LOT of $$. WWYD?,motorcycles,1623521432
,Harley Davidson Wall decor,motorcycles,1623520141
,Where to mount a GoPro on the front of my bike?,motorcycles,1623520108
,"Side mounted Helmet camera causes neck pain and because of that, I didn't record my accident.",motorcycles,1623519593
,Helmet fitment - mouth and nose room?,motorcycles,1623518170
,Uneven wear on rear brake pads,motorcycles,1623517443
,Honda Cbr1000f first motorcycle?,motorcycles,1623516936
,"Dual-sport for a 5'8"" beginner?",motorcycles,1623515589
,Be safe guyss!!,motorcycles,1623515492
,Clicking when clutch is pulled in (FZ07),motorcycles,1623515346
,Antifarkle,motorcycles,1623514587
,"As motorcycles, what are the merits of the Tron Lightcycles' designs?",motorcycles,1623514002
,Honda CBF125 rear brake working in reverse,motorcycles,1623513488
,What would be a good counter offer for a 2007 Yamaha v star bobber,motorcycles,1623513081
,Motorcycles which sound like Harley,motorcycles,1623512655
,I took a left turn and then left turn took me,motorcycles,1623512242
,Got a Honda XL250,motorcycles,1623511480
,Broken clutch cable,motorcycles,1623511219
,Taking my 1969 Honda CT90 Trail out for a spin,motorcycles,1623510734
,"front blinkers not blinking, rear blinkers not turning on at all?",motorcycles,1623510692
,Is scooter worth in big cities?,motorcycles,1623510350
,Brake pad options sintered or Organic?,motorcycles,1623510316
,Fortnine - Why Electric Motorcycles are Failing,motorcycles,1623510183
,"New bike, new TIP permit in Auburn Hills, Michigan",motorcycles,1623509395
,The Batman (2022) Motorcycle - Can anyone identify this?,motorcycles,1623508937
,Can Someone Help With Posting Of A Video?,motorcycles,1623508470
,Why We Ride Motorcycles,motorcycles,1623508215
,CBR600RR Have ABS or No? (Pics Included),motorcycles,1623508102
,"5 miles long motorcade today in Sao Paulo, Brazil",motorcycles,1623507415
,Any DFW adventure bike riders,motorcycles,1623507290
,Ratio on a speedometer?,motorcycles,1623505442
,GHOST RECON ADVANCED WAR FIGHTER 2 ISO DOWNLOAD,motorcycles,1623504292
,From The Batman (2022) can anyone identify the make?,motorcycles,1623504060
,"Engine is sweating - HONDA CB650R (2019, 6.000KMs)",motorcycles,1623502024
,Engine sweating with only 6.000Km ? - HONDA CB650R 2019,motorcycles,1623501599
,"Into MotoAmerica? Check out Malaysian born Kiwi rider, Liam MacDonald.",motorcycles,1623499301
,How To Get That Woman Walking By...,motorcycles,1623498830
,Bork Bork,motorcycles,1623496361
,Unpopular opinion : I absolutely hate bar end mirrors on sport bikes,motorcycles,1623491973
,Lets play Helmet Bonks,motorcycles,1623488811
,How specific are weight requirements for Mopeds?,motorcycles,1623485226
,What Exactly is Auto-Blipping and Is It Something Worth Having?,motorcycles,1623483635
,How do you mount an iPhone 11 to a ram mount without it holding down the power button?,motorcycles,1623482731
,650cc single cylinder sound,motorcycles,1623480520
,Best First Sportish Bike for a 6’4 17 y/o,motorcycles,1623479913
,Dealer hit me up about selling my bike back to them...,motorcycles,1623479835
,Throttle control while turning right,motorcycles,1623478657
,gas in oil DR650,motorcycles,1623478105
,Which type of motorcycle GPS tracker is Cheaper?,motorcycles,1623477508
,Oil changed last year at the beginning of the season (barely rode)... should I still change it now?,motorcycles,1623477474
,Very funny imitation motorcycle sounds,motorcycles,1623476053
,Be nice.,motorcycles,1623475428
,Clutchless shifting???,motorcycles,1623475405
,Has anyone taken their dog for rides with them on a super sport?,motorcycles,1623474473
,Need motorcycle advice,motorcycles,1623472738
,What have I done? (Calling all XJ900 fans),motorcycles,1623472190
,Looking at buying a 2018 sv650 with less than a 1k miles.,motorcycles,1623472177
,"Looking at buying a 2018 sv650 with less than a 1k miles. What should I look for as far as any issues? Based on the miles, it probably was sitting a while at some point. Any issues that will come with that?",motorcycles,1623472126
,I’m new to motorcycles I just got a 06 Suzuki GZ250 still getting the hang of it but what would be some helpful tips at stoplights or stop signs?,motorcycles,1623472049
,First time rider,motorcycles,1623471822
,Best place to hide a GPS Tracker?,motorcycles,1623471511
,Helmet reccomendations,motorcycles,1623470193
,Alright. Let’s talk about speed and the risks involved.,motorcycles,1623469715
,Honda Rebel 250,motorcycles,1623468918
,Buying a former training bike ?,motorcycles,1623467667
,"Just wanted to share, I've been a 2 year lurker on here wanting a bike this whole time but it never working out for one reason or another. Finally, next month I'll be picking up a new 2021 z650 in pearl white/Metallic spark black!",motorcycles,1623467429
,2012 Honda Rebel 250,motorcycles,1623466878
,When a kid asks you to rev for them!,motorcycles,1623465452
,Purchase help,motorcycles,1623465021
,"Once I get more experience and don’t have to double check everything every second, going to start waving at everybody..",motorcycles,1623464437
,"New bike/rider... Changing oil by myself for the first time, would like tips and advice?",motorcycles,1623464405
,Stored motorcycle help,motorcycles,1623463079
,Track Day Edit at ASMA,motorcycles,1623461649
,Owners Manual - 2017 HD Soft Tail Slim FLS,motorcycles,1623461585
,Track Day Edit at ASMA,motorcycles,1623461516
,Track Day Edit Clip,motorcycles,1623461460
,Do I need an endorsement to ride a dirt bike modified to be street legal in Colorado?,motorcycles,1623461136
,Your bikes name,motorcycles,1623461053
,How tf do you do a manual cam chain tensipner,motorcycles,1623460581
,Buell blast making a clicking sound and not starting. Ignore the fact that I held it for a long time,motorcycles,1623459538
,"Buddies 2018 FZ07 just died right now while we were riding, bike won't start and battery is good.",motorcycles,1623458783
,"Buddies 2018 FZ07 just died right now while we were riding, bike won't start and battery is good.",motorcycles,1623458705
,"why is the butterfly valve making that noise? couldn’t unscrew it, seemed it is welded on the pivot",motorcycles,1623457599
,Freeway riding technique question,motorcycles,1623457565
,Does anyone run shinko 777?,motorcycles,1623457169
,Bought My First Ever Motorcycle,motorcycles,1623454364
,They want HOW MUCH for an oil change?,motorcycles,1623453365
,Big bore kit issues,motorcycles,1623452811
,The feeling of my motorcycle brakes changed drastically overnight,motorcycles,1623452397
,Killed her test ride. Goggles and muffs will be in next week!,motorcycles,1623452112
,Canadian advice🤠🇨🇦,motorcycles,1623450925
,Your Riding Instructor Was Wrong(Stop Running Wide in Corners). Canyon Chaser's new video.,motorcycles,1623450482
,What tools do I need?,motorcycles,1623448953
,What tools do I need to adjust the chain on my 2015 Honda CBR300R?,motorcycles,1623448855
,What tools do I need to adjust the chain on my 2015 Honda CBR300R?,motorcycles,1623448586
,can anyone tell me the difference between the ducati supersport and the ducati 899?,motorcycles,1623448347
,What tools do I need to adjust the chain on my 2015 Honda CBR300R?,motorcycles,1623448262
,bike making clicking sound/won’t start after dropping,motorcycles,1623447958
,Can i just top up oil?,motorcycles,1623447801
,Got my baby wet for the first time today...,motorcycles,1623445360
,‘96 zzr600 street fighter conversion advice,motorcycles,1623444755
,Crashing my BMW S1000RR pushing a little too hard,motorcycles,1623444451
,Watch out for wooden bridges on wet days... This happened a thousand miles from home and luckily the bike was fine and my ass only had a bruise.,motorcycles,1623443182
,Need help with tires (Z1000),motorcycles,1623442852
,Cbr 600rr 2005 fuel injector delay,motorcycles,1623439440
,Put 2k miles on my bike in my first month!,motorcycles,1623437971
,Zx6r break in question,motorcycles,1623437885
,Any tips for designing a motorcycle chassis,motorcycles,1623437051
,Long Shot,motorcycles,1623436431
,Ghilli Man (Dustin Apgar)'s helmet drag is 10 years old today,motorcycles,1623436382
,Michelin Road 5 MT-07 / XSR700 pressure advice,motorcycles,1623435650
,New Bike Day,motorcycles,1623434672
,Looking for good/cheap insurance companies,motorcycles,1623434105
,Do polyester/textile mesh jackets break in over time?,motorcycles,1623432756
,"RBI help, any info on this, 2006 Honda VTX 1300 front turn signal replacement bulb",motorcycles,1623431601
,SENA 50S,motorcycles,1623431455
,Help! 1987 Suzuki intruder missing wire,motorcycles,1623431231
,why do we care about racing?,motorcycles,1623430486
,College in Idaho auctioning off 4 new motorcycles from the 1980s with &lt; 20 miles,motorcycles,1623430049
,Mysterious Starting Issue,motorcycles,1623429963
,SOmeone needs to learn,motorcycles,1623429623
,50 years of progress! Woah! (1971-&gt;2021),motorcycles,1623428717
,YouTubers who ride,motorcycles,1623427936
,Conundrum: '09 TU250x or New SuperCub?,motorcycles,1623427750
,Need to replace my 2001 Honda Nighthawk with something newer but similar,motorcycles,1623427617
,your motorcycle next to your name,motorcycles,1623427615
,New Motorcycle - Title Question,motorcycles,1623427245
,Does anyone know where i can buy a oil filter cap to yamaha wr125x ? And where can i buy small details to have around the bike?,motorcycles,1623426856
,I'm too scared to lean this far on a wet road!,motorcycles,1623426818
,Fork seals behaving badly,motorcycles,1623426801
,Returning novice looking to tour. Thoughts?,motorcycles,1623425670
,Dianese jacket zipper ripped. Am I SOL?,motorcycles,1623423757
,Rear stand replacement wheels?,motorcycles,1623423168
,Had a close call with a bird the other day,motorcycles,1623421885
