Unnamed: 0,title,subreddit,created_utc
,Some mishaps while restoring the RD80MX my father had when he was 16,motorcycles,1624565578
,AGV K1 vs Scorpion EXO-R420,motorcycles,1624565346
,Any riders in Egypt?,motorcycles,1624564394
,Any riders in Egypt?,motorcycles,1624564336
,Something really dumb just happened to me…,motorcycles,1624564310
,Any riders in Egypt? Let me know!,motorcycles,1624564298
,Bike weight importance,motorcycles,1624563801
,Help me pick a used $6k commuter &amp; canyon carver that doesn't look like an insect,motorcycles,1624562960
,Bike stops running when choke is off,motorcycles,1624562872
,Yamaha France: Are your customers a necessary INCONVENIENCE to doing bus...,motorcycles,1624562552
,Thinking about buying a xr250r,motorcycles,1624562514
,Hey guys I live in Whitby Ontario. I just bought my first bike G310 Gs 2019. I wanna get crash bars installed on it. I have no idea where can I get them from. Let me know if you guys have any suggestions. Thanks,motorcycles,1624562269
,Lowering a Harley Sportster,motorcycles,1624560497
,"Motorbike pushed over by drunk dudes, caught them afterwards...",motorcycles,1624560227
,Hello Gentlemen! I have a full stock 2017 HD Iron 883 and would like to lower it down using the Burly slammer shocks. Is it okay if I just do it on the rear shocks or do I really have to do it with the front shocks too? Thank you.,motorcycles,1624560219
,How to remove tank sliders,motorcycles,1624559258
,Watch for pedestrians please,motorcycles,1624558687
,Motorcycle Safety Study,motorcycles,1624558298
,WRR's belong in the dirt. (and occasionally - ice),motorcycles,1624557959
,I have a fear of riding on the interstate.,motorcycles,1624557635
,Common bike issue?,motorcycles,1624556217
,Karen cherry popped,motorcycles,1624555738
,"After months of tinkering, my project VFR lives!",motorcycles,1624555296
,How to prepare for your first bike trip? 5 Tips,motorcycles,1624554857
,Dealership trade in question,motorcycles,1624554292
,One bike for the rest of your life?,motorcycles,1624554159
,One bike for the rest of your life.,motorcycles,1624553915
,If you can only have one bike for the rest of your life.,motorcycles,1624553736
,Lexmoto LXR 125cc as first bike,motorcycles,1624553682
,I was unimpressed by the MSF (Rant),motorcycles,1624553664
,Doing what WRRs are supposed to do in northern NevCal.,motorcycles,1624553527
,Armored motorcycle pants for women?,motorcycles,1624553401
,Meta - Stop it with the local law questions,motorcycles,1624551715
,Will the MSF course waiver my permit test at the Washington State DOL?,motorcycles,1624551181
,Gorilla glue question,motorcycles,1624550936
,New Clutch Cable,motorcycles,1624550072
,Shot in the dark...chasing HRC carbys for VFR400 NC30,motorcycles,1624549310
,"Having trouble with Red Kote tank sealer on my gas tank, couple questions..",motorcycles,1624548851
,Motorcycling virgin,motorcycles,1624546353
,"Ladies, what pants do you wear while riding?",motorcycles,1624546225
,125 cc motorcycles with v twin engines,motorcycles,1624545488
,Music. Yay or nay?,motorcycles,1624545091
,[survey] What is the bike you most regret selling?,motorcycles,1624543548
,"New Ride, 2021 XSR700",motorcycles,1624543279
,Where should my eyes be looking during a corner?,motorcycles,1624543255
,Baja phoenix 250,motorcycles,1624542964
,Fried clutch?,motorcycles,1624542156
,I got a 120 front instead of 110 stupid thing to do?,motorcycles,1624541975
,Today marks one year of riding.,motorcycles,1624541095
,Is this a rare motorcycle? I saw it at the place i got my front tire changed at and ive never seen one before.,motorcycles,1624541035
,95 Vulcan 1500 questions/help needed,motorcycles,1624540573
,Well got into my first crash on Father’s Day.,motorcycles,1624537859
,PSA: Have Comprehensive coverage,motorcycles,1624537726
,why don't gay men ride motorcycles?,motorcycles,1624537072
,"Badass - SuperMoto, SportCars, Motocross, MTB e.t.c",motorcycles,1624534407
,21’ Aprillia Rsv4 or 21’ Ducati Panigale v4,motorcycles,1624533765
,Stolen Bike :(,motorcycles,1624533061
,shoei rf-1400 or shoei x-spirit 3,motorcycles,1624532303
,Bought my first bike today,motorcycles,1624528955
,Breaking in new tyres,motorcycles,1624527289
,"Looking back at my worst ride ever, to today",motorcycles,1624525091
,Mount Bromo Enduro,motorcycles,1624524971
,Mount Bromo Enduro,motorcycles,1624524897
,Bajaj Dominar 400 or CFMoto NK400,motorcycles,1624522692
,Hi I need more friends on discord,motorcycles,1624521685
,Made a huge mistake?,motorcycles,1624520915
,What happenes if I turn the engine off or it cuts out when I am driving along in gear? Will the back wheel lock up or will the bike just come to a gradual stop? Just curious,motorcycles,1624519288
,[Very curious] Does anyone have a breakdown of European reliability?,motorcycles,1624517231
,"after 3 years out of the saddle, i finally have my new bike!",motorcycles,1624515654
,KTM 390 duke carving canyons at night,motorcycles,1624513959
,Winterize bike without riding?,motorcycles,1624513928
,Backfire,motorcycles,1624509433
,"It's official, I have my first bike!",motorcycles,1624508847
,Helmet leaving face marks,motorcycles,1624508745
,What do you call your bike and why?,motorcycles,1624507996
,Too much for a first Bike?,motorcycles,1624506864
,My dad will dis own me if I don’t get a slow Harley or cruiser in general,motorcycles,1624506435
,Hellooo ! Need some tips :),motorcycles,1624506072
,glendora mountain road (GMR),motorcycles,1624505914
,"Finally got my license. Is a triumph Bonneville too much for a first bike (850cc, 500lbs)??? I’m 6ft 185 and live in San Francisco (obviously lots of hills).",motorcycles,1624504396
,New rider help,motorcycles,1624504106
,Don't do what I did today - ruined my 2009 ZX-10R motor,motorcycles,1624502448
,Mini bike posted today,motorcycles,1624498716
,[PSA] I love seeing bike rides around the world but please get a windproof foam or dead cat cover!,motorcycles,1624498233
,First 150 mile observations,motorcycles,1624497395
,How do you adjust suspension on fz09/mt09/xsr900,motorcycles,1624497002
,I want to get a bigger bike...,motorcycles,1624495931
,Right fork seal slightly leaking? What to do?,motorcycles,1624495277
,Suzuki gs500,motorcycles,1624494714
,Should I drive with my hi beams?,motorcycles,1624494643
,Always wear your helmet..,motorcycles,1624494616
,Let us not be like them….,motorcycles,1624494399
,Low HP help (2011 CBR 1000rr),motorcycles,1624492799
,clicking sound coming from solenoid when I try to start bike.,motorcycles,1624492569
,Any pointers on my 60' I clutched a little long trying to keep the wheel down,motorcycles,1624491402
,FML,motorcycles,1624491250
,Needed aftermarket ideas for my bike.,motorcycles,1624491003
,MotoMummy,motorcycles,1624490840
,"My town isn’t running an MSF until next Spring, but I’d like to get my license, what can I do?",motorcycles,1624490741
,Can someone id this old bike from the 40s?,motorcycles,1624490410
,Can anyone identify this Triumph bike? Picture was taken around the late 40s early 50s.,motorcycles,1624489901
,Help with motorcycle process (UK),motorcycles,1624489772
,Help with motorcycle process (UK),motorcycles,1624489743
,Downgrading from mt07 ?,motorcycles,1624488661
,I have a question about motorcycle insurance,motorcycles,1624486854
,Will a 2008 Versey shut off before running out of oil?,motorcycles,1624486285
,Fixing a Harley Iron 883 that won’t start,motorcycles,1624484840
,Some busy (fun) laps from my FZ1's first trackday (MSRH 5-8-21),motorcycles,1624482723
,"[Story] I bought a 2021 Honda Rebel 300 ABS for my gf. Walked in on her cheating. So...I guess I have to learn how to ride this thing now, huh?",motorcycles,1624481876
,Any suggestions for helmets I can ware glasses with?,motorcycles,1624481097
,Comfort consensus between cruisers and adventure bikes for passenger?,motorcycles,1624480869
,Rider who wares glasses,motorcycles,1624480699
,GSF650S Bandit Clutch Free Play Question,motorcycles,1624480016
,"That ticking just showed up, any ideas if thats ok? 2013 Yamaha XJ6 Diversion",motorcycles,1624479451
,This single piece of aluminum forms an entire electric motorcycle frame,motorcycles,1624477728
,Purchase advice BMW r65 scrambler,motorcycles,1624477513
,Is the MSF course a joke or is it me?,motorcycles,1624477091
,Sherco 2022 SE300 Walk Around and Startup,motorcycles,1624477001
,My first ride.,motorcycles,1624475244
,Clutch Bite Point,motorcycles,1624474341
,Fiancé was on his motorcycle and was hit. Found out today from insurance agent that the bike is totaled. I have insurance questions if anyone can help.,motorcycles,1624472937
,Motogp Left Foot Braking,motorcycles,1624472806
,I just bought a 94 Yamaha Virago 1100 cc. It’s largest engine I’ve ever ridden and it scares the hell out of me.,motorcycles,1624471713
,Yamaha,motorcycles,1624470919
,ABS Pro,motorcycles,1624469890
,MSF Course Complaints (Rant Kinda),motorcycles,1624468381
,"For god’s sake, take an msf",motorcycles,1624466681
,2008 R1200GS brakepad and fluid change tips and help?,motorcycles,1624466120
,Passed my m1! New rider tips?,motorcycles,1624464839
,Handlebar faint wobbling when at high speeds after having tyre replaced,motorcycles,1624463083
,"Scappoose Highway, Oregon. First real ride on my new CBR 600.",motorcycles,1624462822
,"My Sazuki VanVan, only got my CBT done last week and I’m loving it.",motorcycles,1624458985
,What bicycle would prep me for riding a motorcycle?,motorcycles,1624456324
,Newbie question..,motorcycles,1624454649
,My 2001 SV650S won't go,motorcycles,1624454420
,4000 Motorcycle Deaths,motorcycles,1624452391
,"If I install a digital clock/thermometer, and a 12v on my motorcycle, would that be horrible on my battery.",motorcycles,1624451732
,Selling two motorcycles for cryptocurrency,motorcycles,1624450593
,Klausenpass in the Swiss Alps,motorcycles,1624450170
,2022 Triumph Street Scrambler starting issues,motorcycles,1624449922
,"Help find a new, exciting bike.",motorcycles,1624448214
,any advice on how to get it off? went for a quick bike wash at a local car wash last week and this still hasn't come off the frame.,motorcycles,1624448160
,Ignition switch starting to play up,motorcycles,1624447045
,CB1000R 2018 MY20 Issues,motorcycles,1624446892
,Why do all bike gloves in the shop look rubbish and feel rubbish?,motorcycles,1624446718
,Highway 36 into Estes Park,motorcycles,1624444199
,Saddlebags for Virago.,motorcycles,1624441341
,Shoei RF-1400 Helmet Dilemma,motorcycles,1624439813
,SXF 350. insta:moritz.fhbh,motorcycles,1624437011
,Chain trouble. May have a stretch. Was loose. Tried to tighten. Opinions?,motorcycles,1624436152
,Please be safe. This was a good friend of mine,motorcycles,1624434720
,"My good friend wrecked, please be safe out ther",motorcycles,1624434588
,I'm thinking of buying this 125cc as Im only 16 and can only drive a 125cc at my age in South Africa. Do you guys think this is a good first bike?,motorcycles,1624433392
,Licenses,motorcycles,1624433303
,Virago Gas Tank Options.,motorcycles,1624432512
,"I got a 1994 Virago 750 with a dent on the tank, I think it’s due for another Gas Tank anyway what options are there plug and play is preferable don’t really wanna restore this tank.",motorcycles,1624431142
,"How to get rid of "" Bluetooth Mount "" sound",motorcycles,1624429878
,"Just crossed 10k miles on an Arch Motorcycle KRGT-1. Sadly, the 360 GoPro video couldn't quite catch the moment on the dash when it turned from 9999 to 10,000. Uncertain if I can talk Keanu into giving me a fresh bike to try this again.",motorcycles,1624428838
,"First time rider, new bike without tachometer needing a little help with kmowing when to shift up and down.",motorcycles,1624423897
,Will there be any noticeable difference if i put a 120 front tire instead of 110?,motorcycles,1624423709
,"Highway 243 to Idyllwild, CA",motorcycles,1624422971
,R3 moving in 1st gear while clutches pulled all the way in,motorcycles,1624422264
,100LL (Avgas) in motorcycle engines?,motorcycles,1624416971
,“Hiccuping” “coughing” at highway speeds,motorcycles,1624416249
,Recommendation for tinted riding glasses,motorcycles,1624416096
,Need Help with wiring!,motorcycles,1624415777
,When will I be able to ride again?,motorcycles,1624414043
,Motorcycle insurance - Kawasaki Vulcan Vaquero,motorcycles,1624413875
,Motorcycle insurance - We only ride for 3 months or 4 in a year. Should we keep full insurance year around? Thanks,motorcycles,1624413778
,Motorcycle backed into by uninsured driver,motorcycles,1624411929
,Will running a K8 GSXR 750 without air ducts cause over heating?,motorcycles,1624411365
,How to stop 2 stroke on highway from overheating?,motorcycles,1624410209
,09 ninja speedo wiring,motorcycles,1624409895
,"First Bike, No License. What should I do in the meantime.",motorcycles,1624409812
,"I picked up a finishing nail in my tread, what's the most reasonable way to treat this?",motorcycles,1624409685
,What does it mean when a motorcyclist passes you and throws a peace sign (pointed downward) your way?,motorcycles,1624409223
,Anyone here given up on riding after bike was stolen?,motorcycles,1624407776
,MCO to Title Process???,motorcycles,1624406153
,CO Hwy 121 south of Gateway got resurfaced. Great ride.,motorcycles,1624405780
,2007 Honda shadow 750 Engine Management system.,motorcycles,1624405015
,nyc bike life,motorcycles,1624403140
,What trouble can you get in for spirited canyon and twisty road riding ( USA ),motorcycles,1624402152
,Issues registering a motorcycle,motorcycles,1624401923
,Buddy of mine broke his bike and he forgot to ask the mechanic what exactly the thing he broke does. We are curious help with an answer is appreciated!,motorcycles,1624400997
,Slip-on for 2020 cbr500?,motorcycles,1624397592
,Countersteer epiphany,motorcycles,1624396229
,[Chinese Custom]Embedded heat pipe Suit support by Motor heat waste,motorcycles,1624395253
,Engine running dry on oil after just a couple miles,motorcycles,1624394428
,"Used CBR300R I bought a couple days ago, 5000 miles. Ran fine yesterday, so could this be a dead battery?",motorcycles,1624393741
,LS2 helmets KPA,motorcycles,1624393310
,It's fine!,motorcycles,1624392852
,How do I obtain a Motorcycle Learner's Permit? (Illinois),motorcycles,1624392394
,New Rider 27M - UK - Best piece of riding gear/equipment you’ve bought?,motorcycles,1624388888
,2013 Kawasaki Ninja 650r advice,motorcycles,1624388601
,Any good subs for motorcycle touring?,motorcycles,1624387713
,Any good subs for motorcycle touring?,motorcycles,1624387522
,Any good subreddits for motorcycle touring? Long way round/down/up type touring. Cheers!,motorcycles,1624387446
,On which style of motorcycle does a leather suit fit?,motorcycles,1624387233
,Crack on right crankshaft cover - Looking for advice,motorcycles,1624387028
,Just purchased my second Buell,motorcycles,1624386679
,"People who wheelie, how did you keep your front tire straight in the beginning?",motorcycles,1624386539
,Tell me your horror stories. What was the worst bike you ever owned?,motorcycles,1624386376
,New motorcycle chain has links that are all pretty stiff,motorcycles,1624386369
,Any love for Buells on this sub?,motorcycles,1624386367
,Is this a Harley Davidson? w/Sidecar,motorcycles,1624385580
,Is this a Harley Davidson w/Sidecar?,motorcycles,1624385280
,Anyone have any creative ways of using a regular backpack as a pillion bag?,motorcycles,1624385016
,Definitely put a hurting on my hearing the other day. Need new exhaust.,motorcycles,1624384779
,"What is wrong with my ninja 300, sputtering, dies once I put in 1st gear",motorcycles,1624384313
,Quick trip from Phoenix to Pikes Peak,motorcycles,1624384088
,The Squid Got His First Bike,motorcycles,1624382988
,Why are dirt bikes so low on power but require so much maintenance?,motorcycles,1624382911
,Help! 14'Triumph Tiger Explorer XC,motorcycles,1624382074
,Please can someone help me with this,motorcycles,1624381300
,Please can someone help me with this,motorcycles,1624381203
,Please can someone help me with this,motorcycles,1624380981
,"2009 Yamaha FZ1, slight clicking noise at low RPM",motorcycles,1624380757
,Keep the Shiny Side Up – Stay Safe in the Rain,motorcycles,1624378992
,Stay vigilant out there guys,motorcycles,1624378777
,Sharing Years long experience with RUROC Helmets,motorcycles,1624376836
,I’m an absolute rookie. What bikes are best for beginners?,motorcycles,1624376788
,Beware of cars with broken headlights!!!!,motorcycles,1624375998
,"Crf300l sluggish throttle start , about 200 miles total (180 on dirt road/trail ) this was from a cold start this morning . I believe it may be the air filter as I haven’t changed it yet and it’s pretty dusty , could this be causing the start up issue ?",motorcycles,1624372147
,Licence laws in USA,motorcycles,1624370799
,"Well this ended my ride pretty quick, any guesses? Honda 2003 VT750CD",motorcycles,1624370353
,Upgrated Bike - '96 Er-5 to '04 Z750,motorcycles,1624368675
,Health Issues From Riding Not Commonly Discussed,motorcycles,1624368512
,failed myself out of MSF BRC,motorcycles,1624367592
,Way Of Living - Motocross &amp; SuperMoto 2021,motorcycles,1624365360
,Looking for some quick opinions on going from MT-07 (35kw) to MT-07,motorcycles,1624363002
,LPT: if you get hurt on your bike be careful what you say to your medical provider. Health insurance denies auto related claims.,motorcycles,1624362293
,Engine Swap Thought Experiment - Insurance Too High for SS,motorcycles,1624360354
,looking for advice on paintjob,motorcycles,1624360149
,correct upshifting technique,motorcycles,1624354263
,What are some things you wish you knew before you upgraded your bike?,motorcycles,1624350352
,What are some things you wish you knew before you upgraded your bike? (ex. 400 to 600),motorcycles,1624350121
,"What are some things you wish you knew, before upgrading your bike? (ex. 400 to 600)",motorcycles,1624350012
,Weird whining/howling/whistling noise?,motorcycles,1624349877
,Any weston super mare beginner riders,motorcycles,1624345801
,Abandoned bike (not really),motorcycles,1624345157
,I don't feel connected... Jus gonna be honest here.,motorcycles,1624341385
,"What distance would be considered a ""short ride"" for a 50cc moped?",motorcycles,1624340198
,First bike?,motorcycles,1624339085
,The magic of Barkeepers Friend on motorcycle chrome,motorcycles,1624335530
,Help with motorcycle build.,motorcycles,1624334233
,Finally took the Ducati Streetfighter through the valley,motorcycles,1624333795
,In response to the guy posting his canyon carving video. Here's me enjoying my first dirt day.,motorcycles,1624333404
,Help! Installing TST integrated taillights.,motorcycles,1624332645
,Looking for new plastics for a 1996 Honda cbr600 f3 any suggestions?,motorcycles,1624332629
,"Registered my first bike today and took it for a 2 hour ride, already had a tire skidder from a guy pulling out in front of me.",motorcycles,1624331873
,"I'm wanting a touring bike, but on a budget",motorcycles,1624331147
,Looking for help with a repair.,motorcycles,1624330457
,Does anyone have experience with this backpack?,motorcycles,1624330162
,Favorite YouTube Motorcycle channels,motorcycles,1624328589
,Biltwell Gringo/Lane Splitter: Same fit?,motorcycles,1624326861
,My bike is stalling at first what is the cause?,motorcycles,1624326306
,Can anyone recommend a delivery backpack for food orders?,motorcycles,1624326134
,Learning how to ride and ate shit while (obviously not successfully) learning how to counter steer.,motorcycles,1624324700
,How to avoid redlining a Suzuki GZ250 at highway speeds?,motorcycles,1624324548
,Testing out a GoPro MAX on a motorcycle,motorcycles,1624322964
,Uk practical test,motorcycles,1624321847
,Looking to start in the next year,motorcycles,1624320456
,"Bike feels ""jerky""",motorcycles,1624320443
,How much is too much weight for a passenger?,motorcycles,1624320275
,Honda has launched a new Super Cub 2022 In Europe with a new colorway,motorcycles,1624319655
,Chinese trackers and cafe in USA,motorcycles,1624318786
,"Just got my 2022 Sherco SE 300, here is a video of a short ride I did today",motorcycles,1624317671
,"Harley Davidson is advertising a ""From Evolution to Revolution"" reveal event for July, URL calls it the""bareknuckle event"" and mentions the Sportster",motorcycles,1624317581
,Go pro and motovlogs,motorcycles,1624317136
,I ride a 04 Thundercat and I’m looking to get into motovlogs but I’m more focused on the audio of the bike without any type of wind noise where is the best route to go?,motorcycles,1624317009
,Got any grocery-getting strategies you can share?,motorcycles,1624316049
,RumbleOn… gave me money but won’t take the bike?,motorcycles,1624314857
,Anyone know of free advanced/experienced motorcycle classes in the US?,motorcycles,1624314756
,When you ignore your blind spot monitor...,motorcycles,1624313470
,New HD....VROD redux?,motorcycles,1624313457
,Should I get an fz-o7 or an o9?,motorcycles,1624312892
,are frame sliders worth?,motorcycles,1624312625
,are frame sliders worth? just bought my first bike (2006 fz6) and thinking about throwing some on,motorcycles,1624312524
,Riding this thing for 18 years,motorcycles,1624312161
,Großglockner High Alpine Road motorcycle,motorcycles,1624311940
,"Zx6r, cbr600 or street bob",motorcycles,1624311493
,I recently failed a pa inspection due to “rear fender cutoff (missing)” can someone help explain?,motorcycles,1624311299
,All electronics on my bike went out!,motorcycles,1624311074
,Reliability Question,motorcycles,1624308319
,Scottsdale Motorcycle Study,motorcycles,1624303907
,Can you help diagnose what’s causing this?,motorcycles,1624302253
,"Stop with the safemoon ""squeeze"" bullshit. We aren't a pump&amp;dump token. What we need is organic natural growth &amp; not a hyper inflated pump. We need to advertise the long term benefits of holding &amp; the projects which we have &amp; not how many thousand percent we can go up or down in a day.",motorcycles,1624301938
,Do you guys wear proper protection gears?,motorcycles,1624300956
,"I don’t know anything about motorcycles, where do I start?",motorcycles,1624298072
,Motorcycle Tire Pressure Monitoring Systems,motorcycles,1624297787
,"Oil light on 2020 MT03 won't go off after oil change and Trip Reset, any ideas? Owner's Manual link inside.",motorcycles,1624295820
,"Rode my bike home 10 miles, now it won’t start. I think the spark plug wires were out of order on my ride home because engine was misfiring and I was messing with them. Started right after I got home a few times but was only firing on one cylinder and misfiring.",motorcycles,1624295710
,How do you feel when someone has died riding they're bike!?,motorcycles,1624294917
,Are there any good canyon roads in New England?,motorcycles,1624294704
,Advice for Giant Red Flags-Experienced Riders please help,motorcycles,1624294438
,Eye Irritation,motorcycles,1624293274
,CBR Odometer rolled back by itself?,motorcycles,1624293161
,"I'm looking for motorcycle engine swap candidates for a small and very custom project, was hoping to get some input from more knowledgeable people. Details in post.",motorcycles,1624292102
,Will my engine be okay if a fly flew into my oil pan?,motorcycles,1624290799
,Guy weaves through traffic at well over 100mph then takes exit ramp at same speed. It ends predictably.,motorcycles,1624290692
,Going hard in the Austrian Alps!,motorcycles,1624290574
,Sprocket Nuts Coming Loose,motorcycles,1624290346
,"I've been dreaming of riding motorcycles since I was a kid, and this year I finally had the financial stability to get endorsed and purchase a sport bike",motorcycles,1624288355
,A few weeks ago I rode from SF to San Diego but a huge wreck closed down most of I5 between LA and SD right as I was going through. Google said there were delays of 2~3 hours thanks to this wreck but thanks to lane splitting I made it through in ~45 minutes,motorcycles,1624288081
,Went down last week in the dumbest way possible and I think I may have broken a rib :/,motorcycles,1624287952
,Motorcycle seat leaves traces on my pants,motorcycles,1624286322
,Backpacking New Zealand on two wheels. (GoPro footage only),motorcycles,1624285703
,"RevZilla is doing a ""Dumb &amp; Dumber"" motorcycle road trip. This is the trailer. Amazing.",motorcycles,1624284399
,Riding someone brand new bike home for them.,motorcycles,1624283991
,What's one thing u hate about motorcycling?,motorcycles,1624283983
,Did a different kind of canyon carving this weekend,motorcycles,1624282068
,Im thinking about getting a motorcycle,motorcycles,1624281835
,Balancing,motorcycles,1624280840
,[Michigan] Beginner Questions,motorcycles,1624280336
,When are you able to handle a super sport?,motorcycles,1624279979
,need help changing bike gearing,motorcycles,1624277721
,I was really surprised to see this WWII motorcycle being driven in Switzerland yesterday.,motorcycles,1624277352
,Low-profile helmets information,motorcycles,1624273878
,Purchase Advice Superthread,motorcycles,1624273216
,"Aprilia RS4 50CC, can it sound better?",motorcycles,1624272718
,Is this a good deal?,motorcycles,1624271549
,Yamaha r3 r6 throttle tube mod,motorcycles,1624271070
,Advices for a new rider,motorcycles,1624265811
,"Back with the self-built electric supermoto, Malibu Canyon this time!",motorcycles,1624259757
,Post the best looking 07+ cbr 600rr.,motorcycles,1624259077
,"Hello there, I’m a newbie to riding and to this subreddit. I ride a Zontes 125 U1 and wanted to ask for some riding advices, or well any advice you guys can give me. Any advices are welcome :)",motorcycles,1624253825
,DR650 getting second opinion,motorcycles,1624252741
,Stripped screws from hell holding on the panel I need to remove to get to my dead battery. Spent three hours trying everything to walk them out. Any ideas?,motorcycles,1624252167
